Title,Release Date,Language,Hero,Heroine,Music Director,Overview,Vote Average,Popularity
Kiccha,04-11-2003,Kannada,Sudeep,Shweta Agarwal,Hamsalekha,"Kiccha, an unemployed gold medalist tries his best to get a job but due to corrupt bribe system, he fails to get any job. This story tells how an intelligent unemployed youth enters politics and turns big playing their own game against them.",0,0.2836
Excuse Me,12-05-2003,Kannada,Ajai Rao,Divya Spandana,R. P. Patnaik,"Ajay makes a tune which Madhu loves, but she doesn't know who the composer is. Sunil, a selfish brat, pretends to be the composer of the tune in order to woo Madhu.",0,0.3204
Vijaya Dashami,06-06-2003,Kannada,Sai Kumar,Soundarya,Deva,A wealthy kind hearted landlord who is very happy about the return of his son from the oversees. His happiness comes to an end when the hidden truth about his 6 year old daughter who is come down to meet her grand parents is revealed to them.,0,0.1884
Kariya,01-03-2003,Kannada,Darshan Thoogudeepa Srinivas,Abhinaya Sri,Gurukiran,"Kariya, a gangster falls for a rich dancer Maya, but hesitant to express his love due to his criminal history. Meanwhile his enemies in the echelons of underworld conspire to have him murdered.",0,0.1702
Ree Swalpa Bartheera,09-03-2003,Kannada,Shashikumar,Kausalya,Venkat Narayan,,0,0.0839
