Title,Release Date,Language,Hero,Heroine,Music Director,Overview,Vote Average,Popularity
Namma Oorukku Ennathan Achu,2021-03-19,Tamil,Mahendran,Miya Sree,Srikanth Deva,"A mysterious death happens on the auspicious village festival day and after that, the occult starts to happen in village. Young girls go missing and the suicides become a saga. A native youth takes up the task of  finding the cause of mysteries.",0.0,0.2334
Naaye Paeye,2021-04-23,Tamil,Dinesh,Aishwarya,N. R. Raghunanthan,"Four friends, who kidnap a girl for ransom, get the shock of their life after realising that she is a ghost.",0.0,0.2133
Raame Aandalum Raavane Aandalum,2021-09-24,Tamil,Mithun Manickam,Ramya Pandian,Krish,"A villager's search for his two lost bulls turns his village to become breaking news on all the television channels in India,and into an expose of the corruption in politics and media.",6.0,0.257
Meendum,2021-12-31,Tamil,Saravana Subbiah,Anagha,Naren Balakumar,,9.0,0.1968
Sivaranjiniyum Innum Sila Pengalum,2021-11-26,Tamil,Karunakaran,Lakshmi Priyaa,Ilaiyaraaja,"Three women, who belong to different walks of life, go through severe identity crisis because of the patriarchal system in their respective families. Set in three different time periods, the movie throws light on their helplessness and other myriad issues faced by these married women despite them having their life partners by their side.",8.0,0.2422
Aatkal Thevai,2021-02-05,Tamil,Sakthee Sivan,Gayatri Rema,Karthik Raja,Bases on a true story the movie shows the crime of drug facilitated sexual assault.,1.0,0.1643
Theedhum Nandrum,2021-03-12,Tamil,Rasu Ranjith,Lijomol Jose,C. Sathya,"Three friends, who earn money illegally through burglary, decide to bid farewell to crimes. But fate had other plans for them.",0.0,0.2952
Irudhi Pakkam,2021-12-17,Tamil,Rajesh Balachandiran,Amrutha Srinivasan,MS Jones Rupert Niranjan,"An independent young woman, who stays alone in her apartment, is murdered by a stranger. Who is the killer and what forced the person to take her life?",7.3,0.1511
Blood Money,2021-12-24,Tamil,Metro Shirish,Priya Bhavani Shankar,Satish Raghunathan,A journalist from Tamil Nadu goes on a mission to save two men whose lives are at stake in Kuwait prison. Does she succeed?,5.5,0.1863
Manja Satta Pachcha Satta,2021-04-02,Tamil,Guru Somasundaram,Renu Soundar,Ganesh Ragavendra,"A politician and a corporate broker lock horns. As a result, the politician faces an Income Tax raid. On the same day, a couple of youngsters plan to rob an ATM to get attention. As the IT raid and the ATM robbery has some connection, the youngsters get caught. Everyone starts searching for a jackpot and what the jackpot is and what happens to it forms the rest of the story.",0.0,0.1622
Singa Paarvai,2021-11-19,Tamil,Thalaivasal Vijay,Varalaxmi Sarathkumar,Ravi Basrur,"A woman who is undergoing police training, loses her sight in a road accident.  Her life crosses path with a serial rapist. Will her training & willpower save her from the situation?",6.0,0.1409
Chithambaram Railwaygate,2021-02-05,Tamil,Mahendran,Neeraja,Karthik Raja,"A Tale of love filled with, friendship turned enemity, politics.",0.0,0.1882
Methagu,2021-08-13,Tamil,Kutti Mani,Lizzie Antony,A. Praveen Kumar,The true events that happened in Tamileelam to suppress Tamil ethnicity and why Tamil leader Prabhakaran emerged in the Tamil freedom struggle in the Indian Ocean Island nation Srilanka.,6.0,0.1426
E.P.Co 302,2021-12-31,Tamil,NagaSakthi,Kasturi Shankar,Alex Paul,,0.0,0.1088
Pei Irukka Bayamen,2021-01-01,Tamil,S. Kaarthieswaran,Gayatri Rema,Jose Franklin,A couple stays in a haunted house and decides to ignore the presence of two ghosts when they realise that it is impossible to tame them.,0.0,0.1004
Sara,2021-04-14,Tamil,Sathish Natarajan,Shalini Balasundaram,Lingesh,"Sara, a psychology student and the daughter of a former exorcist, takes up a job as a nanny. But what happens when her new job leads her to horrifying situations?",8.0,0.112
