Title,Release Date,Language,Hero,Heroine,Music Director,Overview,Vote Average,Popularity
Vikram,2022-06-02,Tamil,Kamal Haasan,Vasanthi Guru,Anirudh Ravichander,"Amar is assigned to investigate a case of serial killings. When Amar investigates the case, he realizes it is not what it seems to be and following down this path will lead to nothing but war between everyone involved.",7.685,2.8403
1945,2022-01-07,Tamil,Rana Daggubati,Regina Cassandra,Yuvan Shankar Raja,"Set in Burma in the year 1945, Netaji Subhash Chandra Bose plans to launch the INA to fight the British. This is also the time when Adi comes back to Burma to take care of his family business. Upon his arrival, he gets engaged to a British Tasildar’s daughter. Just as he is set to get married, the atrocities of the British keep growing and Adi is forced to fight the British.",5.5,2.357
Love Today,2022-11-04,Tamil,Pradeep Ranganathan,Ivana,Yuvan Shankar Raja,A young couple is made to exchange their phones for a day. What follows is a hilarious and emotional sequence of events that puts their lives in misery.,6.938,2.2307
Manmatha Leelai,2022-04-01,Tamil,Ashok Selvan,Smruthi Venkat,Premji Amaran,Two one-night stands in the life of a man that happen 10 years apart seem to mirror each other. Is there something more to them than what meets our eyes?,4.6,1.0212
Ponniyin Selvan: Part I,2022-09-30,Tamil,Vikram,Aishwarya Rai Bachchan,S. Sivakumar,"The Chola kingdom is under threat from forces both internal and external, and with crown prince Aaditha Karikalan, his younger brother Arunmozhi Varman and the emperor, Sundara Cholar separated by situations, it is up to a messenger to ensure the safety of the kingdom. Can he succeed in his mission, especially with Karikalan's former girlfriend, Nandhini, plotting to bring down the entire Chola empire?",7.128,2.4106
Mahaan,2022-02-10,Tamil,Vikram,Simran,Santhosh Narayanan,"A man's family leaves him when he strays from the path of ideological living in his search for personal freedom. However, as he realizes his ambitions, he also misses the presence of his son in his life. Having fulfilled his dream of becoming a billionaire, does life give him a second chance to be a father?",6.757,1.9789
DSP,2022-12-02,Tamil,Vijay Sethupathi,Anukreethy Vas,D. Imman,"A flower seller's son ends up in a tussle with a ruthless rowdy in Dindigul, forcing him to become a policeman and fight the odds.",6.315,1.2314
Natchathiram Nagargiradhu,2022-08-31,Tamil,Kalaiyarasan,Dushara Vijayan,Tenma,"Love and politics collide when modern day individuals working as theatre artists in fall in love while making a play about love. They realize that it's the social structure that determines their values and thoughts, and for their love to succeed, they have to go against it.",6.9,1.1587
Thiruchitrambalam,2022-08-18,Tamil,Dhanush,Nithya Menen,Anirudh Ravichander,A guy-next-door tries to find romance in his life while also dealing with his personal problems. How long will it be before he realises what he is looking for is right next to him?,7.4,1.4751
Beast,2022-04-12,Tamil,Vijay,Pooja Hegde,Anirudh Ravichander,"A former RAW officer, who is among the hostages in a mall taken over by terrorists, has to foil their plans and prevent the government from releasing a dreaded terrorist, who he had helped put in prison at great personal cost.",5.4,1.963
Yaanai,2022-07-01,Tamil,Arun Vijay,Priya Bhavani Shankar,G. V. Prakash Kumar,"A brash young man tries to prevent his wealthy, large family from being split up by their arch-nemesis, who wants to avenge his brother's death, which he blames on the family.",6.286,0.9252
Buffoon,2022-09-23,Tamil,Vaibhav,Anagha,Santhosh Narayanan,Two Koothu artistes become pawns in a political power game and are falsely implicated in a drug smuggling case. For how long can they evade a determined police hunt?,5.5,0.7468
Hey! Sinamika,2022-03-03,Tamil,Dulquer Salmaan,Aditi Rao Hydari,Govindh Vasantha,A wife who feels suffocated by her husband's incessant attention hires a psychologist to make him fall in love with her so that she can separate from him.,5.6,1.4079
Nitham Oru Vaanam,2022-11-04,Tamil,Ashok Selvan,Ritu Varma,Gopi Sundar,"An introverted young man with OCD, who is dejected after his fiancé leaves him, learns to find happiness and positivity in life from two couples whose stories he reads about.",6.6,1.2617
Laththi Charge,2022-12-22,Tamil,Vishal Krishna,Sunaina,Yuvan Shankar Raja,"Muruganandam, a constable and laththi specialist, happens to face the wrath of a notorious gangster and his son. Little did he know that this would put his 10-year-old son's life in trouble.",6.8,0.8922
Gatta Kusthi,2022-12-02,Tamil,Vishnu Vishal,Aishwarya Lekshmi,Justin Prabhakaran,"Veera, a misguided man who wants a timid, not-so-learned and subservient wife with long hair, unknowingly ends up getting married to Keerthi, an intrepid wrestler who is also more educated than him and has cropped hair. For how long can Keerthi maintain the charade and what happens when Veera comes to know the truth?",5.826,1.0574
O2,2022-06-17,Tamil,Aadukalam Murugadoss,Nayanthara,Vishal Chandrasekhar,A mother fights to protect her son and his oxygen cylinder as they get stuck in a tunnel with other passengers and the oxygen level depleting,4.6,0.6353
Dejavu,2022-07-21,Tamil,Arulnithi,Madhoo,Ghibran,A state DGP's daughter goes missing as predicted by a crime novelist in his story. An undercover cop comes in to unravel the mystery.,6.333,1.0114
Gulu Gulu,2022-07-29,Tamil,Santhanam,Namita Krishnamurthy,Santhosh Narayanan,A travel junkie with no one particular identity to himself creates a chaos when he sets out to help a group to rescue their friend.,4.3,1.1808
Rocketry: The Nambi Effect,2022-07-01,Tamil,R. Madhavan,Simran,Sam C S,"The story of the great Indian rocket scientist, Shri Nambi Narayanan's life, a true patriot, who was turned into a villain in the blink of an eye after being falsely accused of treason.",7.6,1.2195
Kaatteri,2022-08-05,Tamil,Vaibhav,Varalaxmi Sarathkumar,S. N. Prasad,"To escape the wrath of the gangster whom they work for, a gang of treasure-seeking, bumbling criminals go to a hillside village, which, they don't realise is a ghost town, literally!",3.286,1.1463
Valimai,2022-02-24,Tamil,Ajith Kumar,Huma Qureshi,Ghibran,"A honest cop tries to track down the brain behind a series of robberies and murders, but things turn personal when his family become pawns in the criminal's game.",5.6,1.0553
Kanam,2022-09-09,Tamil,Sharwanand,Amala Akkineni,Jakes Bejoy,"A struggling young musician, along with his two friends, with the help of a quantum physicist goes back in time to prevent the death of his mother. What happens next?",7.4,0.9931
Kadaisi Vivasayi,2022-02-11,Tamil,Nallandi,Raichal Rabecca Philip,Richard Harvey,"Maayandi, the only farmer in a village that has abandoned farming, is charged with a petty case that leads to his imprisonment.",8.5,1.2397
Ayngaran,2022-05-13,Tamil,G. V. Prakash Kumar,Mahima Nambiar,G. V. Prakash Kumar,"A young mechanical engineer invents a machine that not only saves a four-year-old baby girl from a borewell pit, but also unearths a mysterious theft case in the city.",5.0,1.0073
Ranga,2022-05-13,Tamil,Sibiraj,Nikhila Vimal,Ram Jeevan,"A newly married couple goes to Manali for their honeymoon only to discover that the hotel they are staying in is secretly recording their clients' private moments and uploading them online. With the boss of the criminal operation on their heels, can they survive?",7.0,1.0222
Don,2022-05-12,Tamil,Sivakarthikeyan,Priyanka Arul Mohan,Anirudh Ravichander,A youngster who is still figuring out what his passion is gets into an engineering college where he clashes with a disciplinarian faculty.,6.1,1.0611
Cadaver,2022-08-12,Tamil,Thrigun,Amala Paul,Ranjin Raj,A pathologist and a police commissioner try to solve a series of murders involving a prisoner. Their journey leads to shocking revelations!,6.1,1.0115
Naai Sekar Returns,2022-12-09,Tamil,Vadivelu,Sivaangi Krishnakumar,Santhosh Narayanan,"Naai Sekar, who decides to make money by kidnapping dogs, learns about his pet dog which was taken away from their family during his childhood. Can he rescue his dog, which is considered as a lucky charm?",7.0,0.9572
Yenni Thuniga,2022-08-04,Tamil,Jai Sampath,Athulya Ravi,Sam C S,"A young man goes after a gang that had shot his fiancée while robbing a jewellery store, where a minister has stashed some valuable diamonds that actually belong to a gangster in the US.",7.0,0.5664
Kalaga Thalaivan,2022-11-18,Tamil,Udhayanidhi Stalin,Nidhhi Agerwal,Srikanth Deva,A corporate behemoth hires a ruthless hit man to find out the identity of a whistleblower in the organization. Who wins in the end - the hunter or the hunted?,5.6,0.8134
Witness,2022-12-09,Tamil,Shanmugarajan,Shraddha Srinath,Ramesh Thamilmani,"With the world of conservancy workers at its center, Witness presents a never-seen-before view of metropolitan cities and the invisible corridors of power lying underneath them.",8.0,0.7506
Cobra,2022-08-31,Tamil,Vikram,Srinidhi Shetty,A.R. Rahman,"A genius mathematician doubles up as a hit man, assassinating people opposing a ruthless corporate behemoth. While he manages to stay ahead of the Interpol and the psychotic head of the corporation, who are after him, can he evade the mysterious hacker who is keen to unmask him?",6.095,0.786
Sinam,2022-09-16,Tamil,Arun Vijay,Palak Lalwani,Shabir Sulthan,Sub-inspector Pari Venkat faces a huge tragedy putting him on an investigation to seek revenge.,4.571,0.8843
Veetla Vishesham,2022-06-17,Tamil,Sathyaraj,Urvashi,Girishh Gopalakrishnan,"While Elango struggles to accept the news of his middle-aged mother's pregnancy, the situation jeopardises his relationship with his girlfriend, Sowmya, and his parents face social ridicule.",7.0,1.3664
Sila Nerangalil Sila Manidhargal,2022-01-28,Tamil,Ashok Selvan,Reyaa Hari,Radhan,"The lives of four people from different walks of life is affected by a disastrous road accident. The regret, remorse and realisation these characters undergo makes the crux of the film.",7.4,0.6099
Oh My Ghost,2022-12-30,Tamil,Sathish,Sunny Leone,Dharan Kumar,"An aspiring adult filmmaker and his girlfriend explore a haunted bungalow located in a small village, not realising that he had a past that has led him to a ghost, who was once a powerful queen.",1.0,0.9427
Enna Solla Pogirai,2022-01-13,Tamil,Ashwin Kumar,Teju Ashwini,Mervin Solomon,Three individuals with clear notions of what romance discover the indefinable magic that is love when they end up in a triangular romantic relationship.,8.0,0.5205
Saani Kaayidham,2022-05-06,Tamil,Selvaraghavan,Keerthy Suresh,Sam C S,A police constable from an oppressed caste and her half-brother go after the dominant caste men who raped her and burned her husband and kid alive.,6.4,0.7766
Etharkkum Thunindhavan,2022-03-10,Tamil,Suriya,Priyanka Arul Mohan,D. Imman,"A lawyer turns judge jury and executioner and goes after a gang, led by a minister's son, that threatens women with videos of them.",5.926,0.8973
FIR,2022-02-11,Tamil,Vishnu Vishal,Reba Monica John,Ashwath Naganathan,"Irfan, an innocent Muslim chemical engineer with an ordinary life, is caught in inexplicable circumstances, when accused of being a most-wanted terrorist, that alter his life & everyone around him.",5.9,0.6966
Maaran,2022-03-11,Tamil,Dhanush,Malavika Mohanan,G. V. Prakash Kumar,An investigative journalist gets into trouble when he publishes an article that exposes bitter truths about a corrupt politician.,4.857,1.0183
Raangi,2022-12-30,Tamil,Gopi Kannadasan,Trisha Krishnan,C. Sathya,"Thaiyal Nayagi, a journalist from Chennai, happens to connect with a terrorist in Tunisia through a fake account in the name of her 16-year-old cousin, Sushmitha. Little she knew that this would put herself and her cousin in danger.",2.9,0.9859
Sardar,2022-10-21,Tamil,Karthi,Raashii Khanna,G. V. Prakash Kumar,An espionage agent who is branded a traitor returns from exile to take down a dubious water project and safeguard the country.,7.0,0.8125
Kuruthi Aattam,2022-08-05,Tamil,Atharvaa Murali,Priya Bhavani Shankar,Yuvan Shankar Raja,"Shakthi, an attender in government hospital wins the friendship of Muthu, a son of kingpin in Madurai. His sudden death forces him to take revenge on the culprits who were responsible for the same.",6.5,0.6922
Maayon,2022-06-24,Tamil,Sibiraj,Tanya Ravichandran,Ilaiyaraaja,"An archaeology team lead by Arjun Manimaran a curious and intelligent man, is on a quest to break down the myths of an ancient temple, which might put their lives at risk, whilst their work continues other conflict arises which threatens to destroy the temple's relics and antiquity.",4.8,0.6529
Koogle Kuttappa,2022-05-06,Tamil,K. S. Ravikumar,Losliya Mariyanesan,Ghibran,"A curmudgeonly, very conservative old man gets a robot as a caretaker and becomes very attached to it. Can his robotic engineer son make him realise the danger posed by the machine before it is too late?",5.7,0.7806
My Dear Bootham,2022-07-15,Tamil,Prabhu Deva,Remya Nambeesan,D. Imman,"A boy with stammering frees a genie, who helps him deal with his issues, but can he, given his speech disorder, grant the latter's one wish?",6.0,0.6333
Gargi,2022-07-15,Tamil,Kaali Venkat,Sai Pallavi,Govindh Vasantha,"When a schoolteacher's father is arrested for the rape of a 10-year-old girl, the media storm surrounding the case has lawyers reluctant about defending the accused. An inexperienced advocate with a speech disability agrees to take up the case despite the stiff opposition and ridicule from his association. It is now up to them to build their defence and prove that the man accused of committing the crime did not do it.",7.3,0.7063
Captain,2022-09-08,Tamil,Arya,Aishwarya Lekshmi,D. Imman,"A team of soldiers, led by a brave army captain, takes up a dangerous mission to go into a restricted forest area and uncover the mystery behind the unexplainable deaths of previous teams that had visited the site.",4.8,0.6052
Viruman,2022-08-12,Tamil,Karthi,Aditi Shankar,Yuvan Shankar Raja,"An intrepid and good-hearted son fights to make his arrogant father pay the price for his sins, which includes his mother's death, and save his brothers from the man's grip.",5.5,0.6269
D Block,2022-07-01,Tamil,Arulnithi,Avantika Mishra,Kaushik Krish,A young engineering student along with his friends unravels the mystery around his college where several girls go missing and dead.,5.0,0.6407
The Legend,2022-07-28,Tamil,Arul Saravanan,Urvashi Rautela,Harris Jayaraj,"A scientist is spurred by the death of his friend to find a cure for diabetes, but can he take on the might of the pharma mafia and succeed in his mission?",2.625,0.5871
Driver Jamuna,2022-12-30,Tamil,Aadukalam Naren,Aishwarya Rajesh,Ghibran,"Jamuna, a cab driver, finds herself in trouble when three contract killers get in for a ride. Can she save herself from this horrific situation?",5.5,0.6311
Payanigal Gavanikkavum,2022-04-29,Tamil,Vidharth,Lakshmi Priyaa,Shamanth Nag,"After spending two sleepless nights taking care of his sick daughter, Ezhilan, a person with hearing and speech disability falls asleep in a metro. A Social Media Addict captures this moment and uploads it on social media with a caption saying 'Drunkard On A Public Transport'.",6.0,1.5182
Vendhu Thanindhathu Kaadu,2022-09-15,Tamil,Silambarasan,Siddhi Idnani,A.R. Rahman,A youngster from Tamil Nadu goes to Bombay in search of a better life and gets sucked into the underworld. Will he be able to find a way out of the violence and bloodshed?,6.333,0.6587
Anbarivu,2022-01-07,Tamil,HipHop Tamizha Adhi,Kashmira Pardesi,HipHop Tamizha Jeeva,"Separated twins, Anbu and Arivu have been brought up in two worlds, one which is filled with blood stain and revenge and the other is filled with Wisdom and Peace. Anbu and Arivu are forced to switch from their worlds to reunite their estranged family.",6.2,0.5471
Prince,2022-10-21,Tamil,Sivakarthikeyan,Maria Ryaboshapka,S. Thaman,"A happy-go-lucky teacher finds himself falling in love with a British woman who is teaching English at the same school. He tries to woo her, but given that his grandfather was a freedom fighter, can he convince his father of the match?",3.5,0.531
Varalaru Mukkiyam,2022-12-09,Tamil,Jiiva,Kashmira Pardesi,Shaan Rahman,"Karthik is an aspiring YouTuber, who wants to be famous and his friend Adaikalam aspires to be a politician. Karthik falls in love with Yamuna, his new Malayali neighbour but Jamuna, sister of his love interest falls in love with Karthik.",4.5,0.5304
Maha,2022-07-22,Tamil,Silambarasan,Hansika Motwani,Ghibran,A mother who loses her child to psycho killer's killing spree goes in search for answers,6.0,0.5694
Naane Varuvean,2022-09-29,Tamil,Dhanush,Indhuja Ravichandran,Yuvan Shankar Raja,"A father finds out that his teenager daughter is possessed, and the only way he can save her is by doing the ghost's bidding, which will mean an encounter with his long-separated twin - who happens to be a psycho killer.",6.0,0.6481
Jiivi 2,2022-08-19,Tamil,Vetri,Rohini,Sundaramurthy K. S.,"Saravanan restarts his life by marrying Kavitha, the daughter of his house owner, and takes up the job of a share-auto driver. As Mani, his friend, comes back into his life, the cycle of events start again putting Saravanan's life in a challenging situation.",6.333,0.5287
Idiot,2022-04-01,Tamil,Shiva,Nikki Galrani,Vikram Selva,"The descendants of two men who betrayed a royal family centuries ago are caught up in events that involve ghosts, revenge and kidnapping.",6.0,0.5745
Veerame Vaagai Soodum,2022-02-04,Tamil,Vishal Krishna,Dimple Hayathi,Yuvan Shankar Raja,"Following his sister's strange death, a hot-headed police aspirant begins his investigation for the true cause of his sister's death. During this time, he meets a ruthless entrepreneur named Nedunchezhiyan. What is the connection between Nedunchezhiyan and his sister's tragedy?",6.2,0.4526
Kombu Vatcha Singamda,2022-01-13,Tamil,M. Sasikumar,Madonna Sebastian,Dhibu Ninan Thomas,"Six friends, who follow Periyaar's ideologies, fall prey to the local caste politics that happens in their hometown. Who is the reason behind this and what happens after?",7.0,0.5218
Visithiran,2022-05-06,Tamil,R. K. Suresh,Poorna,G. V. Prakash Kumar,"Following the death of his ex-wife, a retired police officer, who is known for his investigative prowess, unexpectedly gets pulled into a criminal case involving organ harvesting.",7.5,0.496
Connect,2022-12-22,Tamil,Sathyaraj,Nayanthara,Prithvi Chandrasekhar,The announcement of a nation-wide lock-down due to the spread of COVID-19 pandemic disrupts the peace of a family. What follows is a series of bizarre events as one of them tries to invite the spirit of a family member.,9.0,0.675
Grandma,2022-05-27,Tamil,Hemanth Menon,Sonia Agarwal,Jecin George,"A small girl keeps talking to the spirit of her dead grandmother. When her private tutor finds out about this, she sets out to help the girl and the spirit.",0.0,0.4756
Iravin Nizhal,2022-07-15,Tamil,R. Parthiban,Brigida Saga,A.R. Rahman,"A man on the run looks back on his crime-filled life, the people who have shaped it up, his sins and his one last hope at redemption.",5.5,0.4104
Panni Kutty,2022-07-08,Tamil,Karunakaran,Lakshmi Priya,Krishna Kumar,A down-on-luck man has to run over a piglet that had caused a minor accident to get lucky in life. But the animal belongs to a man who has to keep it safe for his wedding to happen!,4.0,0.5974
Hostel,2022-04-28,Tamil,Ashok Selvan,Priya Bhavani Shankar,Bobo Shashi,"A girl gets trapped inside a boys' hostel, which is under surveillance of a strict warden. Why has she entered the place and what happens next?",2.0,0.3592
Coffee With Kadhal,2022-11-04,Tamil,Jiiva,Malavika Sharma,Yuvan Shankar Raja,Kathir's wedding brings together his two brothers and their reunion causes them to have second thoughts about their current love lives. Will each of them end up with who they want to be with?,6.8,1.639
Yugi,2022-11-18,Tamil,Kathir,Anandhi,Ranjin Raj,"A detective, along with his team and with help of a suspended Police Sub-Inspector, goes in search of a missing girl, Karthika. What follows is shocking revelations about Karthika, who became the victim of power and economic exploitation.",6.0,0.4791
Battery,2022-07-29,Tamil,Rajkumar,Ammu Abhirami,Siddharth Vipin,"Pugazh, a rookie cop earns an immediate disliking from his higher official Inspector Rathnam because of his brilliance in handling the case. Inspector Rathnam is killed by a masked man who shoves expired batteries into his mouth.  A medical industrialist is also done away in the same way. Who is the murderer using the unusual method and why he is doing it and whether he gets caught or not?",4.5,0.4412
Kuthiraivaal,2022-03-18,Tamil,Kalaiyarasan,Anjali Patil,Pradeep Kumar,A man wakes up from a strange dream with a horse tail attached to his body and begins a mind-bending journey to disentangle the real from the imagined.,5.0,0.4242
Diary,2022-08-26,Tamil,Arulnithi,Pavithrah Marimuthu,Ron Ethan Yohaan,"A sub-inspector trainee sets out on a journey to track an unsolved, 16-year-old case. But little does he know that fate and destiny will put him on an exhilarating ride.",6.8,0.3394
Vattam,2022-07-29,Tamil,Sibiraj,Andrea Jeremiah,Nivas Prasanna,A tormented Mano decides to solve his problems after his break-up. But things get worse when he finds himself caught between kidnappers and a distressed couple.,7.0,0.4154
Coffee,2022-11-27,Tamil,Rahul Dev,Iniya,Prasanna Balasubrmanyam,"A girl from a poor family, who loses her parents at a very young age, takes care of her only younger brother and It is when the future looks bright in her eyes, her life is bombarded with unexpected and shocking turn of events.",8.0,0.4118
The Great Man,2022-06-23,Tamil,Vijay Sethupathi,Gayathrie Shankar,Yuvan Shankar Raja,"A humble auto driver is forced to go on the run, leaving his wife and two kids behind, after being cheated by a fraudster. Will he be able to save his family.",5.0,0.3649
Oh My Dog,2022-04-21,Tamil,Arun Vijay,Mahima Nambiar,Nivas Prasanna,A school kid rescues a blind Siberian Husky to prove its worth to the outside world where it was neglected.,5.2,0.4689
Taanakkaran,2022-04-08,Tamil,Vikram Prabhu,Anjali Nair,Ghibran,A group of police recruits encounter horrific treatment at their police training school. Will they overcome the hardships or fall victims to the abusive system?,6.875,0.4905
Selfie,2022-04-01,Tamil,G. V. Prakash Kumar,Varsha Bollamma,G. V. Prakash Kumar,"When Kanal, a B-grade engineering college student, finds out that his dad went on to pay a hefty amount as “donation” to get him the seat, the liquor-swigging student is introduced to the underground world of the admission racket system in colleges.",8.0,0.3414
Rajavum 5 Koojavum,2022-10-24,Tamil,Nandha,Athmeeya Rajan,Ravi Vijay Anand,A group of 6 friends plans to travel to Srilanka. The hurdles and issues faced by the gang during their journey and the secretive reason behind it forms the crux.,0.0,0.577
Pattathu Arasan,2022-11-25,Tamil,Atharvaa Murali,Ashika Ranganath,Ghibran,"Chinnadurai along with his grandfather, a Kabbadi player, try to bring justice for his brother's death. Can they trace out the real culprits or end up confronting them inside the Kabbadi court?",5.0,1.8646
Pistha,2022-10-07,Tamil,Metro Shirish,Mrudula Murali,Dharan Kumar,A man who specialises in stopping weddings enters a tricky situation where his own wedding faces threat.,0.0,2.3119
Mayathirai,2022-08-05,Tamil,Ashok Kumar Balakrishnan,Sheela Rajkumar,S. N. Arunagiri,"A love failure guy , who is addicted to drugs and incidents that happens in his hallucinations creats an illusion of looping.",0.0,0.2769
Sembi,2022-12-30,Tamil,Ashwin Kumar,Kovai Sarala,Nivas Prasanna,"Ten-year-old Sembi and her grandmother Veerayi, an apiarist, live peacefully amidst nature in the hilly regions of Kodaikanal. They lead a beautiful life until three influential miscreants shatter all their dreams. After a tragedy the two escape and board a bus, whose Passengers from different walks of life try to help bringing justice to the duo.",6.1,0.2822
Pattampoochi,2022-06-24,Tamil,Sundar C,Honey Rose,Navneet Sundar,A murder convict facing a death sentence confesses that he is actually behind a series of unsolved murders. Can a cop with PTSD prove that he is actually telling the truth and keep his loved ones alive?,7.0,0.3867
Veerapandiyapuram,2022-02-17,Tamil,Jai Sampath,Meenakshi Govindarajan,Jai Sampath,An orphan murders his girlfriend's father and his brothers. What made him seek out this bloody revenge?,7.0,0.3892
Gurumoorthi,2022-12-09,Tamil,Natarajan Subramaniam,Poonam Bajwa,Sathya Dev Uthayasankar,"An honest cop tries to track down a suitcase filled with ₹5 crore worth of unaccounted cash that belongs to a businessman. With at least a dozen individuals after it, can he recover it before it falls into the wrong hands?",7.0,0.3579
Marutha,2022-01-21,Tamil,Ganja Karuppu,Lovelyn Chandrasekhar,Ilaiyaraaja,"Two families are torn apart by the custom of seimurai, practised in Madurai.",8.0,0.2885
Naai Sekar,2022-01-13,Tamil,Sathish,Pavithra Lakshmi,Ajeesh,"Sekar who works at an IT company in Chennai gets bitten by a neighbourhood scientist's dog, and their souls swapped.",6.0,0.3631
Poikkal Kuthirai,2022-08-05,Tamil,Prabhu Deva,Raiza Wilson,D. Imman,"For Kathiravan, who lost his left leg in an accident,his 8-year-old daughter is his world. She is diagnosed with a congenital heart problem and 7 Million INR is needed to save his daughter. Unable to raise such a huge amount, he plans to kidnap businessman Rudra's daughter.  Instead Kathir becomes embroiled in his own kidnapping plot.",6.0,0.5094
