Title,Release Date,Language,Hero,Heroine,Music Director,Overview,Vote Average,Popularity
Jothi,2022-07-28,Tamil,Vetri,Sheela Rajkumar,Harshavardhan Rameshwar,A pregnant woman's baby is stolen from her womb. Can a cop find the culprits behind such a heinous crime?,7.0,0.3768
Kuttram Kuttrame,2022-04-14,Tamil,Jai Sampath,Dhivya Dhuraisamy,Ajeesh,"Kokila, a village girl and grieving mother, commits suicide and the investigation for this crime falls on two police officers, Nattraayan and Retired DSP Muthukaruppan.",6.5,0.3527
Aattral,2022-10-14,Tamil,Vidharth,Shrita Rao,Ashwin Hemanth,"A mechanical engineer has an aim of inventing unmanned car and his father manages to get money required for project, but dies in a road accident.  A robbery attempt stopped by him leads him to the suspicion about his father's death.He sets out to find the truth with his unmanned car named Roger.",7.0,0.3313
Repeat Shoe,2022-10-14,Tamil,Yogi Babu,Semmalar Annam,Sam C S,"A crew involved in child sex trafficking who kidnaps girl children, abusing them and torturing those who does not comply. These girls feeling trapped and having no way out are in desperation. After many experimentation a scientist successfully end up making a Time Travelling Shoe. While testing it he gets arrested by police, so he ends up hiding invention in a safer place.",0.0,0.2829
Bestie,2022-07-08,Tamil,Ashok Kumar Balakrishnan,Yashika Anand,JV,A couple on a date at a beach resort experiences strange events and the incidents repeat again as they get stuck in a time loop of sorts.,1.0,0.3428
Sivi 2,2022-07-22,Tamil,Tej Charanraj,Swathi,F. S. Faizal,A group of you-tubers exploring a haunted asylum have to face the wrath of ghost existing there for years.,0.0,0.283
Therkathi Veeran,2022-12-02,Tamil,Shaarath,Renuka,Srikanth Deva,"Saarath, a rich, upright and helpful youth, concerned about the welfare of coastal fishermen of his area, takes care of their problems with his friends. His actions rewards not only the love of his life, but also a long list of enemies.  At one point,Saarath's enemies get together and kill one of his friends and frame him for the murder and implicate the police. Can Saarath able to prove his innocence and recover from the crime of murder?",0.0,0.2688
Powder,2022-11-25,Tamil,Nikhil Murugan,Vidhya Pradeep,Leander Lee Marty,"A tale of five breathtaking and ravaging events occurring in one night. Samy murdering the man who cheated his daughter; A bunch of youngsters murder a local politician, butcher and transporting his remains in tea cans; A doctor is driving away hours before her wedding to settle an unfinished business; Parattai an out of work make-up man gets his hands dirty to earn some money; and there’s a burglar duo, and then there’s a cop,  Raghavan NM, who tries hard to bind these threads together.",0.0,0.3539
Estate,2022-12-09,Tamil,Kalaiyarasan,Remya Nambeesan,Guna Balasubramanian,"A journalist, along with her colleagues, decides to investigate the Covelone Estate, which is believed to be haunted. What follows is a series of events that puts their lives in danger.",4.0,0.3551
Parole,2022-11-11,Tamil,Linga,Monisha Murali,Rajkumar Amal,"A mother's demise brings two egoistic and arrogant brothers together, transforming their lives for the better.",7.0,0.2688
Katchikkaaran,2022-12-16,Tamil,Vijith,Swetha Dorathy,Roshan Joseph,"A party cadre, who is very loyal to his leader and works very hard for the party  and does not  even care about anything else including his personal life. When the same cadre is affected by the actions of the same leaders, he rises against him",0.0,0.2156
Undercover Rascals 2,2022-08-25,Tamil,K.K. Khanna,Thasha Krishnakumar,Yuwaji,Venkat works hard to bring down the largest drug empire in the nation. His plan is disrupted when Aditya Sharma is back from prison to seek his revenge.,7.0,0.2009
Muthal Manithan,2022-03-04,Tamil,Aadukalam Naren,Kausalya,Taj Noor,,0.0,0.1763
Anel Meley Pani Thuli,2022-11-18,Tamil,N. Azhagamperumal,Andrea Jeremiah,Santhosh Narayanan,"After being sexually assaulted, a woman realises that the perpetrators are people in power. Battling mental agony, she is now forced to fight social stigma.",9.0,0.2628
Anbulla Ghilli,2022-02-06,Tamil,Soori,Dushara Vijayan,Arrol Corelli,"Ghilli, a dog, navigates through several challenges and experiences with his owner as both of them attempt to win the hearts of their lovers.",0.0,0.2967
Miral,2022-11-11,Tamil,Bharath Srinivasan,Vani Bhojan,S. N. Prasad,"A family with a past and trauma, encounters a series of strange incidences, in a car journey on their way home and runs into trouble in a windmills farm.",5.2,0.3272
Yaaro,2022-02-04,Tamil,Kitty,Upasana Rai,Jose Franklin,"John is a loner, who is being framed for a series of murders; himself becomes a target of an unknown murderer who is dangerous and insanely brutal. As the murderer’s presence is felt everywhere, he must accept one of the greatest psychological and physical challenges on his ability to unravel the mystery of murders around him.",9.0,0.2656
Agent Kannayiram,2022-11-25,Tamil,Santhanam,Riya Suman,Yuvan Shankar Raja,"A struggling private detective is drawn towards a mystery around unidentified dead bodies turning up near railway tracks, and soon the case becomes significant both at the professional and personal levels.",6.5,0.4245
Clap,2022-03-11,Tamil,Aadhi Pinisetty,Aakanksha Singh,Ilaiyaraaja,"Vishnu, a fast athlete runner, has multiple medals on his wall from state championships, he strives to win gold at the national level, but loses his leg & also his father in a tragic road accident, before he can. Later Vishnu settles into a mundane job and is yet to move past the incident that destroyed his career. When he encounters a young rural girl, a budding athlete, whose sportive interests are not encouraged by her near and dear, he takes her under his wings and fulfills his long-cherished dream through her eyes.",7.2,0.2563
Vezham,2022-06-24,Tamil,Ashok Selvan,Janani Iyer,Jhanu Chanthar,A young man tries to discover the identity of the killers of his girlfriend with only the voice of one of them as his clue.,6.5,0.4261
Trigger,2022-09-23,Tamil,Atharvaa Murali,Tanya Ravichandran,Ghibran,"An undercover cop has to stop the mastermind behind a child kidnapping racket, which will also lead to the redemption of his Azheimer's-affected father, a former policeman.",4.667,0.2427
Ward-126,2022-07-22,Tamil,Michael Thangadurai,Shritha Sivadas,Varun Sunil,The investigation over an IT professional's death faces twists and turns as truths about the victim start coming out and he is found to have had multiple marital relationships.,5.5,0.3153
Yutha Satham,2022-03-18,Tamil,Gautham Karthik,Sai Priya Deva,D. Imman,"A young woman is murdered right in front of a police station. The inspector at the station suspects her boyfriend, a private detective, who claims he is innocent. Who killed the girl and why?",6.5,0.3641
Nenjuku Needhi,2022-05-20,Tamil,Udhayanidhi Stalin,Tanya Ravichandran,Dhibu Ninan Thomas,"An upright city-bred IPS officer investigates a mysterious case of three missing Dalit girls in a rural part of Tamil Nadu. While two are found dead, one is missing without any trace. Can he crack the case and get hold of the culprits?",7.364,0.4824
Kaari,2022-11-25,Tamil,M. Sasikumar,Parvathy Arun,D. Imman,"Kaari revolves around the life of a horse jockey in Chennai and how fate brings him to a small village in Ramanad district, who is about to witness the cruelty of money and power.",0.0,0.3263
Super Senior Heroes,2022-10-16,Tamil,K. Bhagyaraj,Ambika,Girishh Gopalakrishnan,"Ganeshan, a 65-year-old widower to impress Aadith, his 7-year-old grandson, forms a pretend superhero league with his friends. When a young girl is kidnapped and Aadith expects his grandfather to rescue her, and they must unexpectedly take real action.",6.0,1.1204
Vaaitha,2022-05-27,Tamil,Nassar,Powlen Jessica,Logeshwaran C,"A poor Laundry worker gets injured in a road accident and finds himself struggling for justice. He and his family suffers, due to conflicts among two different caste groups.",8.0,0.1631
AGP,2022-01-20,Tamil,R. V. Bharathan,Lakshmi Menon,Jay Krish,A girl loses her family to an accident and that leads her to this disorder along with hallucination and depression. Her boyfriend goes missing in a hospital which is all over the news for all the wrong reasons.,0.0,0.1654
Dum Dum Dumeel,2022-11-03,Tamil,Vicran Elanggoven,Pushpa Narayan,Shameshan Mani Maran,"A guy who is about to get engaged and eventually get married, goes to an island for a holiday with his friends only to be entangled in unfortunate events with a gang of robbers. This will lead him to change his entire perspective on his life and life decisions.",9.0,0.2509
Yuddha Kaandam,2022-09-05,Tamil,Sreeram Karthik,Krisha Kurup,Hari Sai,,7.0,0.3423
Kallan,2022-03-18,Tamil,Karu Pazhaniappan,Nikitha Narayan,Krishna Kumar,A son of a hunter starts dealing with guns to make his ends meet. Little does he know that fate would start hunting him and his friends for his decisions.,7.0,0.3472
Achcham Madam Naanam Payirppu,2022-03-25,Tamil,Siddhartha Shankar,Akshara Haasan,Susha,"The story revolves around a teenager from a conservative family who struggles to strike a balance between societal expectations and personal desires. According to the popular adage, Achcham (Fear), Madam (Innocence), Naanam (Coyness), Payirppu (Chastity) are the four ""ideal"" qualities that every good Tamil girl must possess.",4.5,0.2859
Dhadha,2022-12-09,Tamil,Nithin Sathya,Gayatri Rema,Karthik Krishnan,,0.0,0.1798
Kathir,2022-04-29,Tamil,Santhosh Prathap,Rajini Chandy,Prashant Pillai,"A beautiful bond between a youngster who has gone through many failures and an old woman with an inspiring past, and how the young man's life takes a turn after he learns the story of the older woman.",9.0,0.2842
Carbon,2022-01-13,Tamil,Vidharth,Dhanya Balakrishna,Sam C S,A man whose dreams come true tries to discover the identity of the hit-and-driver who has put his father in critical condition.,6.0,0.3998
Theal,2022-01-14,Tamil,Prabhu Deva,Samyuktha Hegde,C. Sathya,"A woman walks into the life of a debt collector, who works for a loan shark, claiming to be his mother. He tries to turn over a new leaf moved by her affection, but can he do so after having ruined the lives of so many people?",6.0,0.2663
Saayam,2022-02-04,Tamil,Ponvannan,Seetha,Nagha Udhayan,A realistic take on the issues while talking about downtrodden people in a derogatory manner.,0.0,0.1937
Adho Andha Paravai Pola,2022-08-26,Tamil,Ashish Vidhyarthi,Amala Paul,Jakes Bejoy,,0.0,0.2047
Koorman,2022-02-11,Tamil,Rajaji,Janani Iyer,Tony Britto,A former cop with mind-reading skills gets involved in a case involving rape and murder. Can he crack it while keeping a lid on the ghosts of his own past?,8.0,0.3248
Pothanur Thabal Nilayam,2022-05-27,Tamil,Praveen,Anjali Rao,Tenma,"Praveen, an ambitious entrepreneur, is pushed to race against the clock and find the stolen money within the next 36 hours to save his father’s reputation and his family. Will the family survive this life-threatening situation?",6.5,0.1622
Vidiyatha Iravondru Vendum,2022-02-11,Tamil,Ashok Kumar Balakrishnan,Hrithika Srinivasan,GKV,"A Horror thriller happening during the course of one night, talks about If there's an accident, how we have to be more responsible on the road",0.0,0.1295
Nadhi,2022-07-22,Tamil,Sam Jones,Anandhi,Dhibu Ninan Thomas,"Thamizh, son of an auto-driver and Bharathi, who belongs to a politician family, fall in love with each other. Will they be able to lead a peaceful life amidst people with castiest mentalities?",0.0,0.1374
Kaalangalil Aval Vasantham,2022-10-28,Tamil,Kaushik Ram,Anjali Nair,S. R. Hari,A guy who is obsessed on having a filmy romantic life has to understand what love truly means after marrying a no nonsense entrepreneur.,0.0,0.2892
Mudhal Nee Mudivum Nee,2022-01-21,Tamil,Kishen Das,Meetha Raghunath,Darbuka Siva,"A refreshing tale of a bunch of high school students, their dreams, first love, music, guitar, football, video cassettes and more.",8.3,0.1559
KADAL,2022-09-23,Tamil,Sakshi K S,Niya babu,suraj nharakkunnath,A girl standing alone in the beach remembers moments with her ex at the same place .Yet even in solitude she finds peace,0.0,0.1575
Kaarottiyin Kaadhali,2022-11-18,Tamil,Elango Kumaravel,Janaki Devi,N. R. Raghunanthan,A cab driver gets caught between the internal affairs of a shady Singaporean businessman who has other plans in place,0.0,0.2089
Enjoy,2022-12-23,Tamil,Madhan Kumar Dhakshinamoorthy,Sai Dhanyaa,K M Rayan,"The domination of social media which paves the way for opportunities for everyone to express their thoughts and opinions freely not only provided vast benefit to the audience but it also created waves of disaster in the society.  To present themselves with fashion and prestigious gadgets,  few youngsters step into this new technological world with the intention changing their lives overnight. Was this actually an opportunity to transform their lives or absolute disaster waiting in the dark shades is the story of ENJOY that will reveal.  A strong social message and multitude of complications intertwined in the story, the director chose adult comedy with intense materials of laughter through youngster’s language of new technological era.  The movie will make you laugh, cry and reshape your belief of the current events happening in everyone's home.",0.0,0.2289
Kambathe Kannemma,2022-04-28,Tamil,Tokoh Sathia,Sangeeta Krishnasamy,'Lockup' Nathan,Kambathe Kannemma a Malaysian Tamil Movie presented by Maraz Ravi under D`Cinema Sdn Bhd. The movie was directed by KK Khanna.,0.0,0.2085
Udanpaal,2022-12-30,Tamil,Linga,Gayathrie Shankar,Sakthi Balaji,"Paraman and his sister Kanmani, who are in dire financial straits, angrily refuse to advise their father Vinayakam to sell their house. When the news comes that Vinayakam has died in an unexpected tragedy, even in that grief-stricken state, the family gets greedy for the compensation that the government is going to provide. But fate twists again as the situation becomes funny yet tragic all at once.",6.0,0.1935
Lilly Rani,2022-09-09,Tamil,Thambi Ramaiah,Chaya Singh,Jerwin Joshuah,"A sex worker sets out on a journey to find the father of her child, who is suffering from rare medical condition.",7.0,0.163
Sanjeevan,2022-10-14,Tamil,Shivnishanth,Dhivya Dhuraisamy,Tanuj Menon,A thrilling snooker game leads Nilan and his friends on a road trip that leads to an unexpected turn of events.,0.0,0.1776
Kadamaiyai Sei,2022-08-12,Tamil,S. J. Suryah,Yashika Anand,Arun Raj,A civil engineer who has lost his job meets a tragic accident when he is about to reveal a shocking truth that will save countless lives.,7.0,0.1453
Thunikaram,2022-05-06,Tamil,Bharani,Semmalar Annam,Tanuj Menon,A notorious child trafficker gets into an ambulance putting the life of a family at risk. Will the family fight him or succumb to the antagonist's evilness?,0.0,0.1188
Naan Mirugamaai Maara,2022-11-18,Tamil,M. Sasikumar,Hariprriya,Ghibran,"Bhoomi, a sound engineer who finds his life as a puzzle when his brother is killed by few gangsters in the city. As Bhoomi decides to take revenge, his life as a common man changes entirely and starts affecting his family big time. Can he protect his family members against all odds?",0.0,0.1081
Akka Kuruvi,2022-05-06,Tamil,Kathir,Varsha Bollamma,Ilaiyaraaja,"After a boy loses his sister's pair of shoes, he goes on a series of adventures in order to find them. When he can't, he decides to participate in a race to win new shoes.",0.0,0.2343
Viyuham,2022-02-21,Tamil,Ajmal Ameer,Anuya Bhagvath,Deepak Nilambur,A group of friends with dreams planned to loot a huge amount from a businesswoman by kidnapping her husband.,0.0,0.1048
Aruva Sanda,2022-12-30,Tamil,V. Raja,Malavika Menon,Dharan Kumar,,0.0,0.1551
Rathasaatchi,2022-12-09,Tamil,Kanna Ravi,Monisha,Javed Riaz,"When a young Naxal Revolutionary (Activist) and a Policeman, from contrasting walks of life, meet at a point, it creates an extraordinary moment. An important question is being asked, which turnarounds the whole perspective.",7.0,0.1379
Not Reachable,2022-09-09,Tamil,Vishwa Sridharan,Sai Dhanyaa,Charan Kumar,"After getting a tip through an app, about a girl being kidnapped, the cops reach the crime scene, only to find out that another girl has been murdered there. How did this happen? Where is the girl who was kidnapped?",0.0,0.079
My Dear Lisa,2022-08-05,Tamil,Vijay Vasanth,Chandhini Tamilarasan,D. M. Udhayakumar,"In a remote locality, A spirit is out to seek revenge. During the run, a lot of deaths happen around. Can the revenge be fulfilled or will the spirit be captured?",0.0,0.2443
Kuzhali,2022-09-23,Tamil,J Vignesh,Aara,D. M. Udhayakumar,"A higher caste school girl tries to elope with her lower caste lover with dream of continuing her studies, after her elders knows about the affair. This creates great chaos in the village & lives are turned upside down.",0.0,0.0614
