Title,Release Date,Language,Hero,Heroine,Music Director,Overview,Vote Average,Popularity
6-5=2,29-11-2013,Kannada,,,,Six friends plan for a trek to an undisclosed mountain in the Western Ghats.,5.8,0.5339
Raja Huli,01-11-2013,Kannada,Yash,Meghana Raj,Hamsalekha,"Raja Huli is a 2013 Indian Kannada-language comedy-drama film directed by Guru Deshpande and written by S. R. Prabhakaran. Produced by K. Manju's home production, the film is a remake of the Tamil film Sundarapandian (2012) which was produced and enacted by M. Sasikumar. The film stars Yash and Meghana Raj in the lead roles. The soundtrack and score for the film is composed by Hamsalekha. The film, which made its theatrical release on 1 November 2013, co-inciding with the Kannada Rajyotsava festival",7.6,0.483
Brindavana,26-12-2013,Kannada,Darshan Thoogudeepa Srinivas,Karthika Nair,V. Harikrishna,"The main story of the movie is about two step brothers Saikumar and Sampath Raj. They are two big shots in a village and both of them are rivals. Karthika Nair and Milana Nagaraj are cousins from the Saikumar and Sampath Raj families. Karthika Nair stays in village, but Milana Nagaraj relocates to the city for her studies. Darshan lives in the same city. In an incident, Darshan helps Milana Nagaraj and they both become friends & finally fall in love.  Meanwhile, Karthika Nair 's marriage is settled with some goonda whom she does not want to marry. So, she asks the help of Milana Nagaraj. Milana Nagaraj tells the whole story to Darshan and asks his help. Darshan enters into the village with the intention to stop the marriage using some clever tricks. While doing that, he fixes many issues in the village and finally he makes both Saikumar and Sampath Raj to stop their rivalry and they all join together at the end.",4,0.4551
Googly,19-07-2013,Kannada,Yash,Kriti Kharbanda,Joshua Sreedhar,"Googly is a 2013 Kannada romantic comedy film directed by Pawan Wadeyar and produced by Jayanna Combines. Yash and Kriti Kharbanda are the lead actors while Ananth Nag and Sadhu Kokila play the primary supporting roles. The film released on 19 July 2013 and opened to a fantastic response at the box office. The film was declared a ""Blockbuster"".",6.5,0.6309
Bhajarangi,12-12-2013,Kannada,Shivaraj Kumar,Aindrita Ray,Arjun Janya,A tantric terrorizes a village called Ramadurga. A man comes to the village to know the mystery of his birth. He learns that his grandfather was killed trying to save the village from the tantrik and he defeats him.,5,0.3777
Bachchan,11-04-2013,Kannada,Sudeep,Bhavana,V. Harikrishna,"Bharat alias Bachchan is a kind-hearted real estate businessman, who is the MD of the Bharat Property Solutions. He is deeply in love with Anjali (Bhavana), who is doing MS in Bellary and wants to deliver honest service to the needy people. But her wish becomes an obstacle for a mining mafia don.",5.8,0.2765
Myna,22-02-2013,Kannada,Chethan Kumar,Nithya Menen,Jassie Gift,"Satya falls for Mynaa, a woman with a physical disability, and marries her. But trouble begins when they meet a doctor who promises to help her but ends up taking her advantage.",3.3,0.3715
Andar Bahar,05-04-2013,Kannada,Shivaraj Kumar,Parvathy Thiruvothu,Vijay Prakash,"Andar Bahar is a 2013 Kannada film directed by Phaneesh S Ramanathapura and produced by Rajanish, Prasad, Ambareesh, Bhaskar, Srinivas and Avinash. The film stars Shivaraj Kumar, Parvathi Menon, Arundathi Nag and Shashikumar in lead roles. Music was composed by Vijay Prakash.",0,0.344
Dirty Picture: Silk Sakkath Maga,02-08-2013,Kannada,Srinivasa Murthy,Veena Malik,Jassie Gift,"The film portrays the story of an aspiring actress who is ready to go to any extent to make it big in the cinema industry. It was inspired by the life of Silk Smitha, a South Indian actress noted for her erotic roles.",0,0.3207
Lakshmi,17-01-2013,Kannada,Shivaraj Kumar,Priyamani,Gurukiran,"Lakshmi is an action-suspense thriller, in which Shivaraj Kumar playing the title role while Priyamani in the female lead role. Lakshmi Narayana alias Lakshmi is a ruthless CBI officer. The film begins with the hero kidnapping a internationally-renowned dancer Akriti. While cops lead by Ravi Kaale capture Lakshmi, they are not aware of his true identity and assume that the kidnapper is being protected by powerful people. Little less they know that he has abducted a terrorist to find clues about his missing wife Priya aka Reshma (Priyamani) and it is believed that she cheated him and left with an underworld don. As he finds the culprits one after another, he gets an anonymous call that make him to come to Hong Kong. His mission is clear - find his wife and kill her along with the kingpin. How he finds his wife? What role does his wife play in the film? Answers to these questions will form the crux of the story.",0,0.2766
Simple Agi Ondh Love Story,28-09-2013,Kannada,Rakshit Shetty,Shwetha Srivatsav,B. J. Bharath,"Rachana persuades her brother to meet her boyfriend's sister, Ithihasini, hoping that cupid would strike them. However, things take a turn when another girl tricks him into falling in love with her.",6.5,0.1655
Kaddi Pudi,07-06-2013,Kannada,Shivaraj Kumar,Radhika Pandit,V. Harikrishna,"A rowdy sheeter yearns for a peaceful life, but politicians use him as a pawn for their selfish ends and don't allow him to lead a normal life.",8,0.2135
Madarangi,10-05-2013,Kannada,Darling Krishna,Vinaya Prasad,J Anoop Seelin,"Deepu, the daughter of a rich businessman, falls in love with her driver Manu. Problems arise when Manu suffers a brain injury and is blamed for the death of an MLA's brother.",0,0.258
Bulbul,10-05-2013,Kannada,Darshan Thoogudeepa Srinivas,Rachita Ram,V. Harikrishna,"A young man rejects a girl's proposal as he is in love with his childhood sweetheart. The girl tries to end her life, this angers her father who is a don and he tries to kill him.",6,0.2646
Varadanayaka,25-01-2013,Kannada,Sudeep,Sameera Reddy,Arjun Janya,No one has entered a biography for him.,5.7,0.2308
Dilwala,04-10-2013,Kannada,Sumanth Shailendra,Radhika Pandit,Arjun Janya,"Dilwala is a 2013 romantic drama Kannada film directed by Anil Kumar (Dilwala Anil). The film stars Sumanth Shailendra and Radhika Pandit.  Shailendra Babu produced this film which was backed with Arjun Janya's music and Sudhakar's cinematography.  Shot at the scenic locales of Bangalore, Mysore, Ooty and Dubai for two songs, the film speaks about a campus romance between a village farmer girl and a rich brat boy. The film received average response from the critics and performed above average at the box-office with the first weekend collections of up to ₹3.7crores.  Prem, a young college student, falls in love with his classmate, Preethi. Things turn sour for the lovers when Jayasimha, Prem's father, asks him to stop seeing Preethi as her father is his enemy.",0,0.2882
Victory,23-08-2013,Kannada,Sharan,Asmita Sood,,,4.8,0.2059
Adwaitha,06-12-2013,Kannada,Neenasam Ashwath,Harshika Poonacha,Veer Samarth,Adwaitha is a suspense thriller based on a writer who cheats death by telling stories.,5,0.144
Director's Special,31-05-2013,Kannada,Dhananjay,Pooja Gandhi,J Anoop Seelin,Director's Special is a 2013 Indian Kannada satire comedy film written and directed by Guruprasad. It stars a debutant Dhananjay along with Rangayana Raghu in the lead roles. Actress Pooja Gandhi made a special appearance in an item song. The storyline of the movie was also found in two more Kannada movies—Dasavala and Karodpathi. It was also reported that the concept of all these films could be traced back to the 1996 Spanish language Brazilian film Familia (also known as Segredos em Familia) in which a lonely rich man hires actors to act as his family members on his birthday.,0,0.1036
Whistle,12-07-2013,Kannada,Chiranjeevi Sarja,Pranitha Subhash,,"Whistle ....Hodi Magaa is an Indian Kannada film directed by Prashant Raj of Love Guru Fame. The story begins on a romantic note with Ram, a pizza delivery boy who marries his girlfriend Anu after she gets pregnant. The story takes a curious turn when Ram, who visits Smitha Bungalow to deliver pizza. The drama that follows in the haunted house is linked to diamonds. It’s a remake of Tamil blockbuster 'Pizza'.",7,0.2027
Galaate,11-01-2013,Kannada,Prajwal Devaraj,Kriti Kharbanda,Jassie Gift,A classic college love triangle story. Ankitha is in love with her college mate Abhi but Abhi falls for her friend Shalini. Who will Abhi eventually choose?,1.333,0.1677
Jatta,11-10-2013,Kannada,Kishore,Sukrutha Wagle,,"When forest guard Jatta's wife runs away with a tourist, he is not able to handle the loss and enslaves another woman in his forest home.",0,0.1885
Nam Duniya Nam Style,28-06-2013,Kannada,Likith Shetty,Milana Nagaraj,Shaan Rahman,"Nam Duniya Nam Style is a 2013 Kannada adventure film, written, directed and produced by Preetham Gubbi. It stars Likith Shetty, Vinayak Joshi, Krishna, Sonia Gowda, Milana Nagaraj, Kavya Shetty. The film is ""about three people who hail from different backgrounds and who have been friends for 15 years. The trio are a jovial and fun-loving lot, and are excited about their first travel abroad together"", said Preetham, who admitted he was inspired by the Hindi film Dil Chahta Hai. H C Venu was the cinematographer, while Shaan Rahman composed the music for the movie. The film was extensively shot in Karnataka, Kashmir and Malaysia",0,0.1716
Topiwaala,15-03-2013,Kannada,Upendra,Bhavana,,A 2013 Kannada movie.,7,0.14
Auto Raja,21-06-2013,Kannada,Ganesh,Bhama,Arjun Janya,"Raja, an auto-driver, is in awe of the successful actor Shankar Nag. His life changes when he meets Rani, a village girl, who comes to the city to become an actress",0,0.1239
Ziddhi,22-03-2013,Kannada,Prajwal Devaraj,Aindrita Ray,,"Sahana falls in love with her classmate, Krishna, who fights against injustice. But his actions catch Sudhir's eye, a local gangster's younger brother, who is trying to woo Sahana. The film is a remake of 2009 Malayalam film Puthiya Mukham.",0,0.1256
Charminar,08-02-2013,Kannada,Prem Kumar,Meghana Gaonkar,,"The film deals with the life of a man in comparison with the famous monument Charminar in Hyderabad, that shows four important pillars including family, guru, friends and lover.",5,0.1434
Bharath Stores,05-04-2013,Kannada,H. G. Dattatreya,Sudharani,V Manohar,Govinda Shetty doesn't accept globalization which brought the countries nearer. Because even he was a part when India also accepted these which resulting in the gradual change in the lifestyle by popping up Malls and Marts.,0,0.1217
Padhe Padhe,15-02-2013,Kannada,,Akhila Kishore,,"The story is about Sunny, who is a singer in love with Kanchana. There is a twist in the tale as she gets engaged to the son of a politician. Sunny becomes an alcoholic and tries to forget her, but fails. Spoorthi is an event organizer, who is in love with Sunny and helps him to overcome his depression by supporting him to become a popular singer.",0,0.1236
Jayammana Maga,15-08-2013,Kannada,Duniya Vijay,,Arjun Janya,A mother and a son struggle with their relationship and with paranormal activity. The film is set in the village backdrop and speaks of a mother-son relationship which is falling apart. The film also deals with paranormal issues.,0,0.1506
Shravani Subramanya,27-12-2013,Kannada,Ganesh,Amulya,,An aspiring singer dreams of making it big in the music industry.,0,0.1265
Story Kathe,24-05-2013,Kannada,Tilak Shekar,Parvatii Nair,,"Story Kathe movie is based on the two men Veera(Thilak) and Rajeev(Pratap Narayan)and how their fates cross each other, lives intersect and inner worlds ...",0,0.0821
Manna Payana,30-12-2013,Kannada,,,,"Journeys are about the interludes between coming and going, about marking time from one action to another. Waiting, arrival or departure -- a boy is waiting for his father, playing with his toy while waiting, father arrives, but......",0,0.0214
Hajj,25-07-2013,Kannada,,,,Reservation talks about the side-effects of reservation in general in society. It's one of the most relevant and sensitive issues that needs to be told in an effective manner,0,0
Ugramm,21-02-2014,Kannada,Sriimurali,Hariprriya,Ravi Basrur,"Shivarudra Lingaiah, an MLA candidate, who along with Dheeraj, is awaiting to extract vengeance upon Prabhakar by killing his Daughter Nithya. She arrives at Bangalore to Talagavara to visit her late mother's grave and is kidnapped by Dheeraj's gang on the way. Agastya is an automobile mechanic, who saves her from Dheeraj's gang. He takes her to his house for safeguarding as advised by Prabhakar's family-friend, Vishwa.",6.7,0.8822
Adhyaksha,15-08-2014,Kannada,Sharan,Hebah Patel,Arjun Janya,"Adhyaksha is a 2014 Indian Kannada language comedy film directed by Nanda Kishore. It stars Sharan, Heeba Patel, P. Ravi Shankar, Malavika Avinash, Chikkanna and Ramesh Bhat. It is a remake of the Tamil film Varuthapadatha Valibar Sangam.  The music for the film and soundtracks were composed by Arjun Janya.",3.5,0.9449
Power,28-08-2014,Kannada,Puneeth Rajkumar,Trisha Krishnan,S. Thaman,"A politician slips into coma after being attacked by criminals. He wakes up several years later to find his son having taken up his responsibilities. However, things are not what they seem to be.",4,0.7344
Ninnindale,16-01-2014,Kannada,Puneeth Rajkumar,Erica Fernandes,Mani Sharma,Vicky Venkatesh ( Puneeth Rajkumar) is an adventure enthusiast based in New York. He's tried everything from sky diving to rock climbing. Pramila (Erica Fernandes) comes to New York in ...,6,0.5226
Thirupathi Express,05-09-2014,Kannada,Sumanth Shailendra,Kriti Kharbanda,Arjun Janya,"Thirupathi Express' is a clean fun-filled family entertainer, starring Sumanth Shailendra and Kriti Kharbanda in the lead roles. . The film is a travel love story. The family of Sumanth is bound to Tirupathi, while on the journey he meets many characters, turning out to be a roller coaster ride of adventure. What happens when he misses the train, forms the crux of the story.",2,0.4871
Ulidavaru Kandanthe,28-03-2014,Kannada,Rakshit Shetty,Tara,B. Ajaneesh Loknath,"Malpe, a small fishing town on the Arabian Coast. Located 6 kms to the west of the temple town, Udupi. Malpe's beaches are washed clean everyday by the sea. The waves ensure that nothing gets left behind on the sands. But then, the waves cannot reach everything. It is the time of the year when Udupi and its surroundings are decked up to celebrate Sri Krishna Janmaashtami. Men and children walk the streets dressed up as characters from mythology. Teams painted as tigers are seen dancing to drum beats all around the town. But violence seems to be brewing in Malpe this Krishna Janmaashtami.",7.8,0.3931
Mr & Mrs Ramachari,25-12-2014,Kannada,Yash,Radhika Pandit,,"Lovers Ramachari and Divya part ways when Divya begins to question Ramachari's love, trust and way of life. Will they reconcile?",6.4,0.4234
Ragini IPS,28-03-2014,Kannada,Avinash,Ragini Dwivedi,,A female IPS officer is fighting against corruption and corrupt people.,7.5,0.3401
Rangan Style,21-02-2014,Kannada,Pradeep,Bharti Singh,Gurukiran,"Rangan Style is a Kannada Romantic Comedy Drama film written and directed by Prashanth S starring Pradeep and Kannika Tiwari in the lead roles. This film also starring Sudeep in an important guest role and also starring Rekha Das, Sadhu Kokila, Gurukiran, Sharath Lohitashwa, Tabla Nani and others.",0,0.2732
Jai Lalitha,27-06-2014,Kannada,Sharan,Disha Pandey,V. Sridhar,"Jai Lalitha is a remake of Malayalam movie Maya Mohini and it is a comedy entertainer in which, Sharan will be seen in female role thought the movie.  The film starts with a plane accident in which a small child narrowly escapes. He is then looked after by his maternal uncle, and all the family's wealth will be inherited to him. As per their astrologer, in the future he should marriage a girl whose star is Chothi Nakshatra, only then will he prosper in life. The boy grows up to be a young man, who is unsuccessful in anything he does.  He falls in love with the daughter of a wealthy businessman, who is settled in Mumbai. When he gets to know about their relation, he objects. In the meantime a friend of Sharan tries to convince Sharan's uncle about the marriage and the uncle agrees to visit the couple. But then, on the second day of the marriage Sharan's lover leaves him and returns to Mumbai.",0,0.3111
Love Is Poison,20-06-2014,Kannada,Sadhu Kokila,Poonam Pandey,Sai Kiran,,0,0.3202
Drishya,20-06-2014,Kannada,V. Ravichandran,Navya Nair,Ilaiyaraaja,"Rajendra is a family-oriented man and tries to keep them happy. However, when his family commits an accidental crime, he does everything to keep them out of harm's way.",7.3,0.3015
Small Things Big Things,31-12-2014,Kannada,,,,"If this were a letter, the return address would be: From the students and teachers of Sita School, Silvepura, Bangalore 560090, India. If this were a diary, it would contain entries between 5th June 2012 an 28th April 2013. I return to my first school and join with the present students and teachers in their everyday adventures of learning. Through the stories that unfold we enter imaginary worlds and intimate relationships. 'Small Things, Big Things' is a celebration of when Education becomes Art.",0,0.2737
Maanikya,28-03-2014,Kannada,Sudeep,Ranya Rao,Arjun Janya,A village strives to overcome the rivalry between two ancient factions.,5.2,0.2963
Bahuparak,25-07-2014,Kannada,Srinagar Kitty,Meghana Raj,,"Manas, Mani and Mauni are at a critical stage in their lives wherein Manas is caught in a love triangle, Mani is on his way to become a crime boss and Mauni resorts to corruption for political gains.",3,0.283
Namo Bhootatma,28-10-2014,Kannada,Avinash,Iswarya Menon,,"A man inherits a bungalow which he renovates and turns into a hotel. As customers begin to arrive, each one invariably ends up dead and the owner begins to suspect that the house may be haunted.",0,0.2106
Gajakessari,23-05-2014,Kannada,Yash,Amulya,V. Harikrishna,"It deals with the story of Baddi Krishna (Yash),who will be a cool dude in the town. Ananth Nag, who will be the Matadhipathi(chief of temple) will decide to make Baddi Krishna as his successor.Though Krishna will not be interested in the traditional and religious practices,situation will leads him towards that post.",4.8,0.2101
Gharshane,03-01-2014,Kannada,Ashish Vidhyarthi,Malashri,Manikanth Kadri,"Gharshane is a 2014 Indian Kannada language action thriller film directed by Dayal Padmanabhan, and is a remake of the 2011 Tamil film, Yuddham Sei. It stars Malashri, Ashish Vidyarthi and Ayyappa Sharma in the lead roles. The supporting cast features Roopika, Muni and Keerthiraj.",0,0.2761
Brahma,07-02-2014,Kannada,Upendra,Pranitha Subhash,,"Brahma, a notorious gangster, escapes to Malaysia. He meets a girl who falls in love with him instantly. Everything changes when Brahma returns to India followed by the girl.",0,0.2854
Ambareesha,20-11-2014,Kannada,Darshan Thoogudeepa Srinivas,Rachita Ram,V. Harikrishna,A simple man from a village comes to a city to make his fortune and will not accept mistreatment from anyone.,4.7,0.1924
Aryan,25-07-2014,Kannada,Shivaraj Kumar,Divya Spandana,Jassie Gift,"Aryan, a successful athlete-turned-coach, takes Shwetha under his wing, and moulds her into an ace athlete.",3,0.2123
Super Ranga,19-09-2014,Kannada,Upendra,Kriti Kharbanda,,"Super Ranga (Kannada: ಸೂಪರ್ ರಂಗ) is a 2014 Indian Kannada language action romance film directed by Sadhu Kokila and produced by K. Manju under the banner K Manju Cinemaas. It stars Upendra and Kriti Kharbanda in lead roles. The supporting cast features Priyanka Rao, Raghu Mukherjee, Doddanna, Rangayana Raghu, Bullet Prakash, and Sridhar. The film is a remake of the 2009 Telugu film, Kick.",2,0.197
Bahaddur,19-08-2014,Kannada,Dhruva Sarja,Radhika Pandit,,"Bahaddur is a 2014 Indian Kannada language film directed by Chethan Kumar and produced by R. Srinivas. It stars Dhruva Sarja and Radhika Pandit in the lead roles. The supporting cast features P. Ravi Shankar, Achyuth Kumar, Jai Jagadish and Srinivasa Murthy. The film released on October 3, 2014, in 7.1 surround sound, the first in Kannada cinema.",9,0.2082
Dil Rangeela,07-03-2014,Kannada,Ganesh,Rachita Ram,Arjun Janya,"Preetham, a chef and a compulsive liar goes on a secretive, fun trip to Goa after getting engaged to his rich employer's only daughter.",4,0.1811
Harivu,04-12-2014,Kannada,,,Charan Raj,"After his son suffers from severe illness, the farmer decides to take him to Bengaluru for treatment. Unfortunately, when the son dies, the farmer faces trouble taking the body back home.",0,0.1247
Chandralekha,07-03-2014,Kannada,Chiranjeevi Sarja,Shanvi Shrivastava,Jeevan Babu,Four people who decide to commit suicide at a resort find themselves haunted by a vengeful ghost. (A remake of the Telugu film Prema Katha Chitram (2013)),0,0.144
Savaari 2,01-01-2014,Kannada,,Sruthi Hariharan,,Sequel to the 2009 Indian film with Srinagar Kitty reprising his role but with an otherwise new cast,0,0.1805
Namo Bhoothatma,01-01-2014,Kannada,Ali Basha,Iswarya Menon,,"Namo Bhootatma is a 2014 Kannada horror comedy film directed by ace choreographer Murali. A remake of the 2014 Tamil film Yaamirukka Bayamey (which itself was based on the Korean movie The Quiet Family), it stars Komal Kumar, Iswarya Menon, Anaswara Kumar, Gayathri Iyer, and Harish Raj in the lead roles. Telugu comedian Ali makes his Kannada debut with this film.",0,0.1447
Kwatle Satisha,01-01-2014,Kannada,,,,"Kwatle Satisha is a Kannada Black Comedy, directed by Mahesh Rao. A young man injures himself on the head while playing cricket with his friends. The young man develops short term memory loss and turns clueless about his wedding. The dilemma of his friends, unfolds into a hilarious situation.",0,0.1023
Crazy Star,14-02-2014,Kannada,V. Ravichandran,Priyanka Upendra,,This story revolves around five men who coincidentally meet at a traffic junction. Soon their lives are turned topsy-turvy due to a tragic incident that takes place. What could it be?,0,0.0688
Fig Fruit and The Wasps,19-10-2014,Kannada,Achyuth Kumar,,,"Gowri, a documentary filmmaker, travels with her cameraman Vittal to a remote village in search of a musical teacher for her project, which requires her to study how music is shaped by different locations. However the musician is nowhere to be found. The two are forced to wait for his return.",0,0.0904
Chaali Polilu,30-10-2014,Kannada,Aravind Bolar,Padmaja Rao,,"It tells the story of three best friends named Pandu, Damu and Manju. All three of them are up to no good as they never showed interest in studies, and are now jobless. In order to make a living, they try different things but end up in a big problem. Will they be able to manage their way out of this situation?",0,0.0404
Khushi Khushiyagi,18-11-2014,Kannada,,Nandini Rai,,"Khushi Khushiyagi is a 2015 Indian Kannada romantic comedy film directed by Yogi G. Raj, a former associate of directors Preetham Gubbi and Harsha, making his first attempt at the direction.",0,0.053
Mithileya Seetheyaru,01-01-2014,Kannada,,,,Vishnuvardhan stars in this film Ravi.,0,0.0368
Huccha Venkat,28-11-2014,Kannada,R. N. Sudarshan,,Rajesh Ramanathan,"Venkat, a vigilante, falls head over heels in love with Ramya. She spurns his love, but he tries to impress her at all costs.",0,0.0454
Dec-01,25-04-2014,Kannada,H. G. Dattatreya,Niveditha,V. Manohar,"Chief Minister's officially organized visit is a great event, particularly to the poor family specially selected to host his dinner & overnight stay in its humble abode. The extra attention bestowed on the family, in preparation for this visit, gives it a feeling of elevated status and a brighter future.  The visit is a great success with a grand welcome, photo shoots, interaction with Press & local leaders, dinner and wide media coverage.  But the family is neglected, faces embarrassment and gets a raw deal driving it to despair.",0,0.0311
Mythri,20-02-2015,Kannada,Mohanlal,Bhavana,Ilaiyaraaja,"Fast paced and evocative, this contemporary social drama delves into concepts of love and fidelity in human relationships in view of modern liberal lifestyles, through the lives of a scientist and a news anchor.",7,1.2612
Rangi Taranga,03-07-2015,Kannada,Sai Kumar,Nirup Bhandari,B. Ajaneesh Loknath,"Mysterious events begin to unfold after a reclusive novelist and his wife move back to her ancestral village, followed by a journalist.",6.8,1.0281
Ranna,04-06-2015,Kannada,Sudeep,Rachita Ram,V. Harikrishna,"Bhargava, the heir apparent of a wealthy family in Switzerland, is on a mission to reunite his aunt and grandfather. Of course, this isn't easy since his aunt holds a lot of grudges and isn't willing to pardon him right away.",6.2,0.9804
Boxer,20-11-2015,Kannada,Dhananjay,Kruthika Jayakumar,V. Harikrishna,"Raja, a street boxer, falls in love with a blind girl Lakshmi, who shows him love and compassion. Raja, who has a few enemies, dreams of living happily ever after with her. Is this possible?",0,0.9052
Sharp Shooter,11-12-2015,Kannada,Diganth Manchale,Sudharani,,"Sharp Shooter is a cocktail story with mixture of various elements such as love, drama, action and romance. The story revolves around a boy named JK and a girl named Nandhini. They end up falling in love with each other. However, they end up having a hard time trying to accept each other.",5,0.7282
Vajrakaya,12-06-2015,Kannada,Shivaraj Kumar,Nabha Natesh,Arjun Janya,Vajrakaya is a Kannada film directed by Harsha A and produced by C. R. Manohar and C R Gopi. The film stars  and Shivaraj Kumar in lead roles. Music was composed by Arjun Janya.,4.3,0.584
