Title,Release Date,Language,Hero,Heroine,Music Director,Overview,Vote Average,Popularity
Bhairava Geetha,07-12-2018,Kannada,Dhananjay,Kalpalatha,Ravi Shankar,"Set against the backdrop of violent class, a love story of a man who turns into a rebel in a battle between feudal-minded oppressors and the downtrodden.",6,0.3688
Gultoo,30-03-2018,Kannada,Naveen Shankar,Sonu Gowda,,"Struggling to find a foot in the start-up scene, two aspiring entrepreneurs are entangled in a vicious loop of investigative trials following an unprecedented crime.",7.7,0.3167
Vaasu Naan Pakka Commercial,03-08-2018,Kannada,Anissh,Nishvika Naidu,B. Ajaneesh Loknath,"Vaasu, a young man who falls head over heels in love with Mahalakshmi, however, little does he know that his actions would have adverse repercussions on his family.",3,0.2466
Humble Politician Nograj,12-01-2018,Kannada,Danish Sait,Sumukhi Suresh,Sricharan Pakala,"Nograj, a narcissistic crazy politician who exploits a city and its resources. The film is about Nograj's aspirations to becoming the MLA in the upcoming elections and the opposition he faces.",5.5,0.3938
Dhwaja,27-04-2018,Kannada,Ravishanker Gowda,Priyamani,Santhosh Narayanan,,0,0.2245
Aa Karaala Ratri,13-07-2018,Kannada,Karthik Jayaram,Anupama Gowda,R. S. Ganesh Narayanan,"Muthanna and his family, who live in abject poverty, receive a prediction that says their fortune will change overnight. The same day, a mysterious man arrives and requests them to let him stay back.",5.6,0.2829
Kanaka,26-01-2018,Kannada,P. Ravi Shankar,Manvitha Harish,,"Kanaka is a 2018 Indian Kannada romantic action film directed by R. Chandru. It features Duniya Vijay, Hariprriya and Manvitha Harish in the lead roles along with P. Ravishankar, Rangayana Raghu and Sadhu Kokila in key supporting roles.",0,0.3417
Orange,07-12-2018,Kannada,Avinash,Priya Anand,,"While on a train journey, a rich lad Ganesh meets a cute bubbly girl Khushi and falls in love with her. He gathers the courage to talk to her but loses her in the crowd.",2.5,0.3478
Churikatte,26-01-2018,Kannada,Praveen Tej,Aruna Balaraj,,"An aspiring policeman decides to take matters into his own hands and save the local policemen when criminal activities worsen in Churikatte, unaware of the repercussions that await him.",8,0.2663
The Terrorist,18-10-2018,Kannada,Ravi Bhatia,Ragini Dwivedi,,"The lives of two sisters, Reshma and Asma, is thrown into disarray when Reshma receives a call about Asma's kidnapping.",0,0.1782
Ambi Ning Vayassaytho,27-09-2018,Kannada,Ambareesh,Suhasini Maniratnam,,A 65 years old man starting a journey to find his first love who broke up 40 years ago.,5,0.2101
Brihaspathi,05-01-2018,Kannada,Manoranjan Ravichandran,Mishti Chakravarty,V. Harikrishna,"Sudhir, a graduate who is unemployed for several years, finally lands a job by overcoming various obstacles.",0,0.2296
Ayogya,17-08-2018,Kannada,Sathish Ninasam,Rachita Ram,Arjun Janya,"Sidda wants to provide basic amenities to his village in Mandya, by becoming a gram panchayat member, but he faces several ordeals to complete his mission.",3.7,0.3234
Onthara Bannagalu,17-08-2018,Kannada,Kiran Srinivas,Hitha Chandrashekar,B. J. Bharath,,0,0.1992
Double Engine,01-01-2018,Kannada,Chikkanna,Suman Ranganathan,,,0,0.2325
Iruvudellava Bittu,21-09-2018,Kannada,Tilak Shekar,Meghana Raj,V. Sridhar,"Poorvi, an independent woman, leaves her family and boyfriend, Dev, due to ger ego and self-conceit. Despite making several imprudent decisions, her life comes back on track after meeting Akash.",0,0.2639
Naduve Antaravirali,31-08-2018,Kannada,Chikkanna,Aishani Shetty,,,0,0.2298
8MM Bullet,16-11-2018,Kannada,Jaggesh,,,"8MM Bullet movie is a crime thriller movie written and directed by Harikrishna and jointly produced by Narayan Swamy, Infant Pradeep and Saleem Shah while Judah Sandy scored music for this movie.  Jaggesh playing for the time different role in this movie.",1,0.1731
Sankashta Kara Ganapathi,27-07-2018,Kannada,Likith Shetty,Shruti Goradia,,"Ganapathi, a cartoonist, is diagnosed with a neurological disorder called Alien Hand Syndrome, which poses a hindrance in his daily life. Despite the disorder, Ganapathi attempts to achieve his goal and also goes on to woo the girl he loves.",6.5,0.2123
Ondalla Eradalla,24-08-2018,Kannada,Nagabhushana N S,,Vasuki Vaibhav,"The story revolves around a seven year old boy named Sameera who looses his pet Banu. He goes alone in search of his pet to a town called 'Pete', along the way he meets many people from different sections of society. Innocence is the main theme of the movie, whether his innocence can reign over the selfishness of the people he meets on the way to recover his lost pet forms the main crux of the movie.",0,0.1983
Rajasimha,02-02-2018,Kannada,Ambareesh,Nikita Thukral,,"Yuvaraja falls in love with Pallavi, and when pursuing her, he gets to know more about his past and his uncle who wronged him",0,0.1322
The Bangle Seller,26-01-2018,Kannada,,,,"A village bangle seller and his wife cannot conceive a child. The villagers gossip. In this close-knit patriarchal community in South India, hidden desires and relationships find a way to exist. Will the husband's secret ever come out? An intriguing narrative in an elegantly directed debut with exceptional camera work.",8,0.1259
Samhaara,09-02-2018,Kannada,Chiranjeevi Sarja,Hariprriya,,"Samhaara is a 2018 Indian Kannada action thriller directed by Guru Deshpande. It features Chiranjeevi Sarja, Hariprriya and Kavya Shetty along with Chikkanna in the lead roles",5,0.1304
Jeerjimbe,16-11-2018,Kannada,,,Charan Raj,Jeerjimbe is a story of adventures of a 13 year old girl from a remote village in Karnataka. The story is based on emotional struggles of a girl when a bicycle enters her life as part of free cycles programs provided by the Government to all high school children in rural areas.,0,0.1217
Life Jothe Ondu Selfie,17-08-2018,Kannada,Prem Kumar,Hariprriya,V. Harikrishna,The journey of the three friends who face different situations as they travel along.,0,0.1656
Dr. Sukanya,23-03-2018,Kannada,,,,"Dr. Sukanya is an accomplished, well trained doctor. She refuses Dr. Arvind’s marriage proposal, after learning his bad intentions. Ambujamma, a woman with a wrong intuition about girl child, trusts astrologer more than anyone, forces her daughter-in-law to get aborted from her pregnancy. Anand, son of Ambujamma and his wife Sarala are expecting a baby are forced to check if the fetus is male or female. The conflict between two doctors and an elderly woman is a story of female feticide. What will Dr. Sukanya do to save the child?",0,0.1346
Beti,27-02-2018,Kannada,,,,"Suleiman had gone off to work overseas immediately after marriage. Meanwhile, his wife Juleka gave birth to a girl-child, Salma. But for fear of disappointment, husband Suleiman was fed to believe that they had a male-child, Salman. For years, Suleiman was unable to visit Juleka and the child, so when news came of Suleiman's impending return, the whole household is thrown into panic.",0,0.1228
Swartharatna,28-12-2018,Kannada,Sadhu Kokila,Sapna Raj,,A tech-savvy youngster and slightly arrogant youngster leads a life of comfort with the help of his celebrity friends until he meets and falls in love with a woman whose character is the complete opposite of his own.,0,0.1174
Vivekananda By Vivekananda,04-10-2018,Kannada,,,Praveen D Rao,"The film is based on the autobiographical writings of Swami Vivekananda, the 19th Century warrior monk of India.  ‘Vivekananda by Vivekananda’ begins with the young Swami swimming across the turbulent Indian Ocean, climbing the rock in the middle of the Ocean to meditate. In solitude, he realizes his life’s mission ‘Upliftment’ of the masses of India. Thereupon, begins one of the most adventurous journeys in Indian history.",0,0.1301
Shathaya Gathaya,08-06-2018,Kannada,M. S. Umesh,Sonika Gowda,,,0,0.161
Good Bye,24-08-2018,Kannada,Shobaraj,,,,0,0.0916
Padarasa,10-08-2018,Kannada,Niranjan Deshpande,Vaishnavi Chandran Menon,,,0,0.1018
Varnamaya,23-11-2018,Kannada,,,J. V. Sudhanshu,A renowned artist's life descends into chaos when he is haunted by the spirit of an unknown girl.,4,0.0882
Jayamahal,06-04-2018,Kannada,Neenasam Ashwath,Shuba Poonja,Judah Sandhy,"A palace in Jayamahal is disowned by a rich family. Three generations later, the family returns back to their ancestral palace and soon experience some unexplainable activities.",0,0.1208
Abhisaarike,10-08-2018,Kannada,Yash Shetty,Sonal Monteiro,,"Abhi and Sarika are lovers who hope they will have their happily ever after. But, Sarika also has a lunatic stalker in the form of Sunil, who hopes on getting his 'Bangaru'. How does Sunil affect their lives?",0,0.0776
Ammachi Yemba Nenapu,02-11-2018,Kannada,Raj B Shetty,,,"Based on three short stories by the celebrated Kannada writer, Kendra Sahitya Academy awardee Dr. Vaidehi. With dialogue in the characteristic regional dialect of coastal Karnataka. Woman’s eternal striving for identity in a patriarchal society is told through the story of a young woman resisting being married off, an older woman gone mad after her husband left her and an older woman being indebted to a family who's matriarch took her in when she was left by her husband at a young age.",7,0.0604
Ramarajya,10-08-2018,Kannada,Karthik,Swathi Konde,,"Ramarajya follows how Gandhiji had envisioned of ruling India as one country as per the principles of Ramarajya, which was laid out by Lord Rama and had a vision of an unbiased nation where everyone was equal.",0,0.3919
Vandana,10-08-2018,Kannada,,Shobitha Shivanna,,,0,0.0596
Ananthu v/s Nusrath,28-12-2018,Kannada,Vinay Rajkumar,Latha Hegde,Sunaad Gautham,"Ananthu is advocate belonging to an orthodox Brahmin family, who falls in Love with Nusrath Fathima baig, a Muslim girl. How Ananthu wins his love is the plot. Whole love story revolves in Court and Narrated in a humorous way.",6.2,0.1379
Trunk,13-07-2018,Kannada,Nihal Rajput,Vaishali Deepak,Karthik Pradeep Ganeshan,,4.5,0.085
Naguva Nayana,16-12-2018,Kannada,,,,Art mimic's life,0,0.0445
Vanilla,01-06-2018,Kannada,Ravishanker Gowda,Swathi Konde,,"A mystery ingredient that a lot of people seem to be consuming unknowingly is resulting in serious addiction, and in many cases, untimely deaths. Caught right in the midst of this undercover scam is a young couple.",0,0.0825
Kannadakkaagi Ondannu Otti,06-07-2018,Kannada,Chikkanna,,Arjun Janya,"Avinash, a young journalist, meets his friend after many years and they set out on a journey. However, little do they know that the trip will change their lives forever.",0,0.0416
Puttaraju Lover of Shashikala,10-08-2018,Kannada,,Jayashree Aradhya,,,0,0.0338
Mudlaseemeyali,28-02-2018,Kannada,,,,"A widow belongs to tribe, wants to make her only daughter, literate. This tribe has a tradition of selling girls and widows. Her Father-in-law quotes his sons’ debts and he borrows money. She decides to leave the house, goes to her brother’s place. When the money lender arrives, he starts harassing her as he had already spent 1.25 lakh on her. She refuses to join him. This becomes a bigger issue than she has ever imagined. When the village heads meet up and decide that she should live with the man, who had spent money on her, what option does she have? Will she be able to fight against a male dominant society?",0,0.0143
Apple Cake,23-11-2018,Kannada,,,,A bunch of four men from different places land up in Bengaluru with dreams of making it big in tinsel town. With rejections and hurdles can each of them realize his dreams?,0,0.0261
Kavi,24-08-2018,Kannada,,Shobitha Shivanna,,,0,0.0143
May 1st,24-08-2018,Kannada,Karthik Jayaram,Raksha Somashekhar,,Family in a rather huge farm house on the outskirts of the city and a series of supernatural happenings.,0,0.0143
Hosa Climax,10-08-2018,Kannada,,,,,0,0.0143
Love U 2,13-07-2018,Kannada,,,,,0,0.0071
Rustum,28-06-2019,Kannada,Shivaraj Kumar,Shraddha Srinath,J Anoop Seelin,"The disappearance of an honest IAS officer leads to his family seeking help from police, but to no avail. To their assistance arrives Abhishek, someone who happens to be there for them in times of need. But why does he want to help them? What is his real identity?",5,1.1768
Avane Srimannarayana,27-12-2019,Kannada,Rakshit Shetty,Shanvi Shrivastava,Charan Raj,"In the pursuit of solving an ancient mystery of Amaravati, Narayana, a corrupt cop must battle the dangerous clan of dacoits and it's fierce leader.",7.4,0.844
Visions of Mookajji,29-11-2019,Kannada,,Jayashree B.,Praveen Godkhindi,"An 80-year-old widow with extra-sensory perceptions can see the history behind the objects she touches, through which she comments on evolution of culture, concepts of God, religion, relationships, humans and their sexuality, etc.",10,0.6992
Amar,31-05-2019,Kannada,Sadhu Kokila,Tanya Hope,,"A romantic drama inspired by certain real life incidents from the 1990s, the film follows the story of two youngsters who meet and fall in love during a bike rally. Directed by Nagshekar, Amar stars Abhishek Ambareesh and Tanya Hope in the lead roles",1,0.6534
Kavaludaari,12-04-2019,Kannada,Rishi,Suman Ranganathan,Charan Raj,"The story follows two Bangalore cops as they investigate an old case. Anant Nag plays Muthanna, a retired inspector while Rishi is Shyam, a sub-inspector working in the Traffic Police. Their search leads them across trails that will put their wit, resolve and morals to the test.",6.9,0.8225
Pailwaan,12-09-2019,Kannada,Sudeep,Aakanksha Singh,Arjun Janya,A fierce wrestler becomes the symbol of hope for his people when he rises against the odds and fights the brutal oppression.,6.2,0.6873
Natasaarvabhowma,07-02-2019,Kannada,Puneeth Rajkumar,B. Saroja Devi,D. Imman,A supernatural force influences a guy's behaviour and helps him finish important tasks.,7.3,0.6701
Bazaar,01-02-2019,Kannada,Dhanveer Gowda,Aditi Prabhudeva,,"Kalki is an ardent follower of pigeon racing, which ultimately leads him to working for a mob boss who shares the same passion. Howevere, his dream of becoming a champion in the spot and his quest to win over the girl he loves wil eventually leave Kalki at a crossroads, and what happens next forms the crux of the story.",4,0.5335
Gubbi Mele Brahmastra,15-08-2019,Kannada,Raj B Shetty,,Manikanth Kadri,Gubbi Mele Brhmastra is a 2019 Indian Kannada romantic comedy film written and directed by Sujay Shastry making his debut[1] . The film is produced by T.R.Chandrashekhar under his banner Crystal Park Cinemas. A fun journey of software engineer Gubbi and his friend to release his kidnapped girlfriend.,5.3,0.4877
Seetharama Kalyana,25-01-2019,Kannada,Joy Badlani,Rachita Ram,Anup Rubens,"Arya, the son of an influential man in the city, falls in love with Geetha, an innocent girl from a small town. He thinks his life is set but fate has more than a little trouble in store for him.",4.7,0.6089
Yaanaa,12-07-2019,Kannada,Anant Nag,Vainidhi Jagdish,Joshua Sreedhar,"The film delves into the aspirations and values of today's youth, who would go to any length to achieve their dreams. As the saying goes, the greatest journey is the one within.",5,0.5345
Odeya,12-12-2019,Kannada,Darshan Thoogudeepa Srinivas,Chitra Shenoy,,Gajendra is a kind-hearted man who lives a happy life taking care of his family and the people around him with utmost affection. He has chosen to be a bachelor and hates the term marriage and since his own brothers have to seek his permission for their own marriage proposals they come up with a plan to make him fall in love.,3.5,0.5138
Ayushman Bhava,15-11-2019,Kannada,Shivaraj Kumar,Rachita Ram,Gurukiran,"Krishna enters a big household as the caretaker of the patriarch. He finds out that the granddaughter of the house, Lakshmi, has been kept locked in the household because of her mentally unstable condition and as a caretaker he decides to explore.",6,0.3849
Yajamana,01-03-2019,Kannada,Darshan Thoogudeepa Srinivas,Rashmika Mandanna,V. Harikrishna,The film revolves around a hardworking man Krishna who lives in Hulidurga and is famous for traditional oil extraction. He is torn apart from being the rightful owner with the entry of business tycoon Devi Shetty. Will Krishna fight against all odds to bring justice to his people? Who will become the real `Yajamana` is what forms the crux of the story.,4.7,0.4925
Kannad Gothilla,22-11-2019,Kannada,Gopalkrishna Deshpande,Hariprriya,Nakul Abhyankar,A mysterious tale of non-Kannadiga immigrants going missing in Bengaluru. What happened to them?,1,0.4675
Gantumoote,18-10-2019,Kannada,Surya Vasishta,Teju Belawadi,Aparajith Sris,"A 16-year-old girl embarks on a journey of life where she deals with understanding herself, the changing world, bullying, academic pressure and her transcending journey of first love.",7.3,0.4269
Kiss,27-09-2019,Kannada,Viraat,Sreeleela,V. Harikrishna,"Kiss tells the love story of Nandini and Arjun. Nandini is a young, modern day college student who holds on to traditional values and Arjun is a rich, carefree guy. The film is an exploration of young love, directed by A. P. Arjun and produced by V. Ravi Kumar under Rashtrakuta Pictures. The lead actors are Viraat Vellanki and Sree Leela. The credit for the music score goes to V. Harikrishna and Adi Hari.",2.6,0.4709
Dasharatha,26-07-2019,Kannada,V. Ravichandran,Sonia Agarwal,Gurukiran,"Dasharatha is a court drama movie directed by M.S.Ramesh and produced by Akshay Mahesh K under M.S.R. Production banner while Guru Kiran scored music for this movie  Ravichandran, Sonia Agarwal, Abhirami and Meghashri are played the main lead roles along with Shobhraj, Avinash and many others are seen in supporting roles in this movie.",0,0.472
99,01-05-2019,Kannada,Ganesh,Bhavana,Arjun Janya,99 is a 2019 Indian Kannada-language romance film directed by Preetham Gubbi and produced by Ramu. The film stars Ganesh and Bhavana in the lead roles.The film was released on 1 May 2019. It is a remake of the 2018 Tamil film 96 which was reported to have similarities with the 2016 movie Blue Jay.,6.2,0.4598
Aadi Lakshmi Puraana,19-07-2019,Kannada,Suchendra Prasad,Nirup Bhandari,Anup Bhandari,"Aaditya is an investigation officer, who is pursuing the drug mafia in the country. Lakshmi is a happy-go-lucky girl, working in a travel agency and living life through pranks and innocent lies. When Aadi and Lakshmi’s paths cross, there is a love story waiting to happen.",8.5,0.3017
Katha Sangama,06-12-2019,Kannada,Kishore,Yagna Shetty,Gagan Baderiya,"Anthology of 7 movies blended inside one.  7 directors, 7 DOPs, 7 Musicians and 7 editors have worked in the movie. This is movie is a tribute to legendary Puttanna Kanagal",5.3,0.4747
Nanne Preethse: I Love You,14-06-2019,Kannada,Upendra,Rachita Ram,Kiran Thotambyle,"When Santu meets Dharmika after few years of romantic college life, will he win the lost love, or is there something surprise round the corner.",3.667,0.4535
Gimmick,15-08-2019,Kannada,Ganesh,,Arjun Janya,"A happy-go-lucky poor guy Gani falls in love with wrestler Raani, who hails from a rich family. Raani's father tries every trick in the book to separate Raani and Gani. When nothing works, he comes up with a plan that he is sure will not let him down.",1.5,0.3398
Padde Huli,19-04-2019,Kannada,Shreyas Manju,Nishvika Naidu,B. Ajaneesh Loknath,"Padde Huli tells one such story of a college guy who is torn between his true love and passion for music. Sampath is a happy-go-lucky guy from a middle-class family. His parents are very encouraging. For Sampath, music is his life and his parents always push him to pursue his passion. After school, Sampath joins engineering with his best friend. Incidentally, his sweetheart from school Sangeetha also joins the same college. Sampath confesses his love and Sangeetha reciprocates. The story trudges along the familiar campus life arc - with ragging scenes, clashes with seniors and colourful college events.",5,0.3401
Bharaate,18-10-2019,Kannada,Sriimurali,Sreeleela,,"When Jagan meets Radha, it is love at first sight for him. But finding his happily-ever-after is harder than it seems. A romantic-action film directed by Chethan Kumar, starring Sri Murali and Sree Leela in the lead roles.",3,0.4059
Chambal,22-02-2019,Kannada,Sathish Ninasam,Sonu Gowda,,"Subhash is a young and dynamic IAS officer, His relentless and uncompromising way of working sends shivers across the corridors of power, cutting across political and business circles. Being incorruptible and principled, his idealism and righteousness soon become a threat to the entire system.",3,0.3308
Devaki,05-07-2019,Kannada,Kishore,Priyanka Upendra,,A mother sets out on a quest to find her missing daughter in the city of Kolkata.,1,0.3067
Ellidde Illi Tanaka,11-10-2019,Kannada,Sujan Lokesh,Hariprriya,,"Surya, the son of a rich industrialist, is cupid struck when he chances upon Nandini. The trouble is that the relationship is built on a web of lies? Will he find his happily-ever-after?",3,0.2771
India vs England,14-12-2019,Kannada,Vasishta N. Simha,Manvitha Harish,,India vs England is an upcoming Indian Kannada-language Romantic Thriller film directed by Nagathihalli Chandrashekar and produced by Y.N.Shankaregowda and several Non resident Indians from the UK and other countries. The film stars Vasishta Simha and Manvitha Harish. The film is set to release on 24 January 2020.,2.3,0.2325
Neuron,22-11-2019,Kannada,Jai Jagadish,Vaishnavi Chandran Menon,,A researcher from London who returns to India to search for his missing girlfriend gets caught in a conspiracy much bigger than he realized.,4,0.2421
Bell Bottom,15-02-2019,Kannada,Rishab Shetty,Hariprriya,B. Ajaneesh Loknath,A fun ride to the 80s where a detective solves the mystery of serial police station robbery.,6.9,0.2634
Marshal,06-09-2019,Kannada,Srikanth,Megha Chowdhury,Varikuppala Yaadagiri,"A actor and his fan clash when revelations come to light that the actor is a psychopath hellbent on making women ""fertile"" again,by any means necessary",0,0.1594
Kavacha,05-04-2019,Kannada,Shivaraj Kumar,Kruthika Jayakumar,Ron Ethan Yohaan,An unfortunate young girl becomes the target of a vengeful serial killer who is on the loose. The only person standing between the killer and the girl is a visually challenged man who has vowed to protect her at any cost.,7,0.2288
Udgharsha,22-03-2019,Kannada,Thakur Anoop Singh,Sai Dhanshika,Sanjoy Chowdhury,"A thriller film directed by Sunil Kumar Desai, starring Sai Dhanshika, Tanya Hope and Thakur Anoop Singh in the lead roles.",1,0.3177
Mane Maratakkide,15-11-2019,Kannada,Chikkanna,Sruthi Hariharan,,"A Dubai-based Indian decides to sell his house after the death of his parents. But, the old mansion is haunted and selling it is an uphill task. Why is the house haunted?",6,0.2351
Adhyaksha In America,10-10-2019,Kannada,Sharan,Ragini Dwivedi,,"Ullas is a scamster living in a small town, who'd do anything for good money. A confusion leads him to get married to a rich NRI girl, who has an alcohol problem. What will become of this marriage?",0,0.3207
Savarna Deergha Sandhi,17-10-2019,Kannada,H. G. Dattatreya,Padmaja Rao,,"Muddanna is the leader of a gang that indulges in 'positive rowdyism'. He is in love with Amruthavarshini, an aspiring singer. The film revolves around the gags and misadventures of Muddanna and his gang.",0,0.1599
D/O Parvathamma,24-05-2019,Kannada,Suraj Gowda,Hariprriya,Midhun Mukundan,"An investigative officer investigates a sensational and challenging murder case, which has many layers.",2,0.2292
Geetha,27-09-2019,Kannada,Ganesh,Prayaga Martin,,"Akash, a software professional who comes from a broken home, is a cynical younger who does not really believe in the idea of love. But when he learns about his father's past and encounters love in close proximity in his life, does he find a happy ending?",7,0.1721
Striker,22-02-2019,Kannada,Praveen Tej,Shilpa Manjunath,,Striker is a Kannada movie starring Praveen Tej and Saurav Lokesh in prominent roles. The movie also stars Shilpa Manjunath. It is a crime thriller written and directed by Pawan Trivikram.,7,0.1114
THE REDEMPTION,09-12-2019,Kannada,,,,"Manja and Ravi, two dalit kids live in a tiny village in the western ghats. Vaasudeva, a kid from an orthodox brahmin family wants to be friends with them. This leaves Manja and Ravi in a conflict with their daily lives.",0,0.254
Girmit,08-11-2019,Kannada,,,,"A commercial tale with an all children cast, Girmit is a one of a kind movie.",8,0.1626
Aa Drushya,08-11-2019,Kannada,Achyuth Kumar,Chaithra J Achar,,"Surya Tejas, a retired policeman, narrates the details of a case that he investigated years ago to a former colleague's son. In the process, he reveals what really happened on the day of the crime.",0,0.1766
Fortuner,01-11-2019,Kannada,Diganth Manchale,Sonu Gowda,Poornachandra Tejaswi,"Partha, a good-for-nothing man, falls for Anusha and lies to her about owning a restaurant. When they get married, his dishonesty is exposed which ruins their relationship.",0,0.1782
Aatakkuntu Lekkakkilla,27-09-2019,Kannada,Achyuth Kumar,Mayuri Kyatari,,"This is a story of two couples, one of which is the newly-married Purushotham (Sanchari Vijay) and Meghana (Mayuri), both of whom are orphans, who lead a happy life, until a certain tragedy strikes and Purushotham's behaviour changes drastically. The other is also newly-wed couple, Sangeetha and Shyam, who happen to be in a haunted house and are then troubled by supernatural elements. As it turns out, Purushotham suffers from a paranoid schizophrenia and suspects that his wife has an extra-marital affair with the spirit of her former boyfriend, which, in turn, leaves their family in tatters.",0,0.1742
