Title,Release Date,Language,Hero,Heroine,Music Director,Overview,Vote Average,Popularity
Govinda Govinda,26-11-2021,Kannada,Sumanth Shailendra,Bhavana,,Three college slackers fake a friend's kidnapping to help her escape her strict father. The plan works... until it meets a stranger-than-fiction reality.,0,0.6307
SriKrishna@gmail.com,14-10-2021,Kannada,Darling Krishna,Bhavana,Arjun Janya,"Malavika, a single mother, ends up meeting Sathya, an employee in a five-star hotel, by accident. Her daughter begins to call Sathya her father and Malavika employs Sathya to play that part so as not to disappoint her father. An unexpected twist happens when Sathya learns the truth.",3.5,0.9641
Bhajarangi 2,29-10-2021,Kannada,Shivaraj Kumar,Bhavana,Arjun Janya,"When a group of lost villagers chance upon a Guruji at a shrine, he begins to narrate the story of two unlikely heroes, Anji and Bhajrangi, who lived across two different timelines.",1,0.8324
Yuvarathnaa,31-03-2021,Kannada,Puneeth Rajkumar,Sayesha Saigal,S. Thaman,"A government aided college, RK University, is on the verge of completing its golden jubilee but a bizarre event shuts it down indefinitely. Will RK University restore its lost glory?",5.2,1.1655
Madhagaja,03-12-2021,Kannada,Sriimurali,Ashika Ranganath,Ravi Basrur,"Two warring lords are fighting over water and bloodshed. When the wife of one of them decides to send her son away from the land to a safe space, he returns to the same battlefield, much to her exasperation.",3,0.8123
Rathnan Prapancha,22-10-2021,Kannada,Dhananjay,Reba Monica John,B. Ajaneesh Loknath,Rathnakara is an insurance agent living a mundane life with his unapologetically loud mother Saroja. An uncomfortable truth about his life leads him to go on a trail to find his world. What does he learn eventually?,5,0.7345
Hero,05-03-2021,Kannada,Rishab Shetty,Ganavi Laxman,B. Ajaneesh Loknath,"A barber decides to kill his ex-girlfriend, who is married to a mafia head. While he comes prepared for this to their residence, he gets stuck in a web of misadventures.",6.2,0.4575
Premam Poojyam,12-11-2021,Kannada,Prem Kumar,Brinda Acharya,,Premam Poojyam movie is a romantic action entertainer directed by Raghavendra and produced by Dr Rakshit Kedambadi and Dr Rajkumar Janakiraman while Dr Raghavendra BS scored music for this movie.  Prem Kumar is playing the main lead role and this is his 25th Movie.,10,0.5271
Ninna Sanihake,20-08-2021,Kannada,Suraj Gowda,Dhanya Ramkumar,Raghu Dixit,"Ninna Sanihake chronicles the intimate journey of two young souls - Aditya and Amruta - through relatable and often humorous scenarios, while capturing the nuances of new age romance. A feast for the seekers of entertainment, the film is garnished with the right amount of romance, humor and drama.",0,0.4818
Salaga,14-10-2021,Kannada,Duniya Vijay,Sanjana Anand,Charan Raj,"Vijaykumar, alias Salaga, is unknowingly pulled into the realm of the underworld. Samrat, an honest and upright cop, sees through him and decides to bring about justice.",0,0.5495
Kotigobba 3,14-10-2021,Kannada,Sudeep,Madonna Sebastian,Arjun Janya,"Sathya, a philanthropist who now runs an orphanage, has to go to Poland for the treatment of young Janu. While there, an international criminal named Ghost carries out heists. Who is Ghost? And what has Sathya got to do with it all?",5.8,0.569
100,19-11-2021,Kannada,Ramesh Aravind,Poorna,Ravi Basrur,"Honest police officer Vishnu seems to have the perfect professional and personal life. When a stranger named Harsha, who manipulates and cheats women online, enters his life, he's in for a roller-coaster ride.",7,0.4572
Love You Rachchu,31-12-2021,Kannada,Ajai Rao,Rachita Ram,Manikanth Kadri,"In the midst of a happy relationship, a couple encounters a bad turn in their lives. Will they be able to overcome the obstacles or will the worst times await them?",6,0.5294
Drishya 2,10-12-2021,Kannada,V. Ravichandran,Asha Sarath,B. Ajaneesh Loknath,"Rajendra Ponnappa, a cinema hall owner, thrives in life but is a changed man. However, when his family gets entangled in a criminal investigation, he must protect them from the legal institution yet again.",0,0.4651
Roberrt,11-03-2021,Kannada,Darshan Thoogudeepa Srinivas,Sonal Monteiro,Arjun Janya,"Raghava lives in Lucknow with his son Arjun and is the head cook in a Brahmin's catering unit. He leads a peaceful existence, wanting the best for his son. All seems to go well, until some skeletons come tumbling out of his closet and he is forced to take on his original avatar.",1,0.4861
Inspector Vikram,05-02-2021,Kannada,Prajwal Devaraj,Bhavana,J Anoop Seelin,"Inspector Vikram is the typical do-gooder cop, who also entertains and ensures no crime is left unsolved. What happens when he gets to meet a villain who is smarter than the average criminal and heads a drug racket?",5,0.3742
Pogaru,19-02-2021,Kannada,Dhruva Sarja,Rashmika Mandanna,,"Shiva, a ruffian, is the terror of his area in many ways, but still has a heart of gold. He has just one wish, for his mother to love him wholly like the way he does.",3.7,0.3551
Badava Rascal,24-12-2021,Kannada,Dhananjay,Amrutha Iyengar,Vasuki Vaibhav,"Badava Rascal is the journey of Shankar who lives life on his own terms. When he gets kidnapped along with his friend over trivial issues by goons, how does he get out of the trouble and what is the motto of abduction unravels the theme of the story.",4,0.3398
Arjun Gowda,31-12-2021,Kannada,Prajwal Devaraj,Priyanka Thimmesh,Dharma Vish,,8,0.2639
Mugil Pete,19-11-2021,Kannada,Manoranjan Ravichandran,Kayadu Lohar,V. Sridhar,"Two families stand at loggerheads in their ideologies. A family that has failed to understand that love plays an important role in a relationship, and the other believes that love is the elixir of any relationship? What happens when Raja and Apoorva fall in love?",10,0.3497
Ikkat,21-07-2021,Kannada,Nagabhushana N S,,Dossmode,A couple on the verge of divorce have to stay together during lockdown as a nasty surprise awaits them.,4,0.2245
Seetharam Benoy,16-08-2021,Kannada,Vijay Raghavendra,,Gagan Baderiya,"Seetharam, a cop, gets transferred to a remote village in Shimoga Dist Aanegadde finds himself in middle of a bunch of smart yet cruel thieves. The day he takes charge his house gets robbed. Matter of dignity and personal revenge, intense investigation then begins.",6,0.2331
Aana,29-10-2021,Kannada,,Aditi Prabhudeva,Rithwik Muralidhar,India's First Female Superhero Movie,0,0.1373
Puksatte Lifu Pursotte Illa,24-09-2021,Kannada,Achyuth Kumar,,,"A key maker, Shahjahan living in one of the gullies of Bengaluru becomes an accomplice to a group of policemen in illegal activities. Life takes a turn for Shahjahan when he faces a complicated problem.",7,0.1841
Rider,24-12-2021,Kannada,Nikhil Kumar,Kashmira Pardesi,Arjun Janya,"Rider is a romantic action entertainer movie directed by Vijay Kumar Konda. Produced by Sunil Gowda Chandru Manoharan. The movie casts Nikhil Kumar and Kashmira Pardeshi are in the lead roles along with Dattanna, Achyuth Kumar, Chikanna, Shivaraj KR Pete, Sampada Hulivana, Rajesh Nataranga, Shobaraj, Niharika, Anusha are seen in supporting role while Arjun Janya scored music for this movie.",7,0.3556
Blue Bird,04-06-2021,Kannada,,,,"Sidda is the only child of Maasti, a lazy farmer and Ganapi, a progressive woman who dreams of living in the town. Due to some unavoidable circumstances, the family is forced to move to the city. The film documents Sidda's journey as he explores the dense forest and sustainable living versus the chaotic hustle of the city that makes him feel alienated. Inspired by the folk tales his grandfather narrates, the 10 year old learns to explore all options before he makes the most important decision of returning to his roots.",0,0.2078
Munduvareda Adhyaya,18-03-2021,Kannada,Aditya,Ashika Somashekar,J Anoop Seelin,"ACP Bala lands up in the midst of a murder mystery that has a lot more than what meets the eye. With many characters and twists, he's got himself a case that keeps getting intriguing with every reveal.",0,0.1336
Krishna Talkies,16-04-2021,Kannada,Ajai Rao,Sindhu Lokanath,V. Sridhar,A group of friends go to a village for festivities and later hear stories of some deaths in the area. They soon realize one of them is missing. Will they find her before she is killed?,5.8,0.1525
Pedro,09-10-2021,Kannada,Raj B Shetty,,,"In a village in Southern India, Pedro, an outcast and a drunk, accidentally kills a cow and sets off a revelatory chain of events that pit him against the entire community.",0,0.1128
Kushka,26-02-2021,Kannada,Shobaraj,Sanjana Anand,,"A suspended cop and a mechanic are on the search for a quick buck, while a gang of drug traffickers and gangsters are willing to kill for a valuable stone.",0,0.1438
Mangalavara Rajaadina,05-02-2021,Kannada,Gopalkrishna Deshpande,Lasya Nagaraj,,"Kumara is a barber, who works with his father and runs a shop. Their lower middle-class existence is filled with loans and ideals. But Kumara has a lofty dream to style Kichcha Sudeep's hair.",0,0.1302
Dear Bhargava,16-05-2021,Kannada,,Aruna Balaraj,Udith Haritas,"It is the story of a gay son who due to the obligations of social stigma decides to move out of the country and disconnects himself from a family with the fear of disapproval of his sexuality. When he comes back home due to his father’s demise, post rituals, he finds a letter in his father’s closet addressed to him. The letter unfolds the narrative of the father’s love and an explanation towards the odds of their relationship & unpleasant memories in the past.",0,0.1987
Kaddu Mucchi,03-02-2021,Kannada,Vijay Suriya,Megashree,,"Bengaluru boy Siddharth, aka Siddu (Vijay Suriya), is a happy-go-lucky guy brought up in a nuclear family. He wants to enjoy his life amid nature, but his father wants him to become the managing director of a prestigious construction company. Promising his father that he would take up the role after a year, Siddu decides to go to Theerthahalli, where he meets his dream girl, Aishwarya (Megha Shree). Siddu, who hails from a rich family, wants to marry an orthodox Aishwarya, but she is reluctant to accept his proposal. He tries every trick to win over Aishwarya, even ending up at her house as a marriage broker. Will he be able to win over Aishwarya and her family?",0,0.1067
Talaq Talaq Talaq,22-01-2021,Kannada,,Veena Sundar,Praveen Godkhindi,,0,0.0913
Shadow,05-02-2021,Kannada,Vinod Prabhakar,Shobhita Rana,Achu Rajamani,"A man registers a complaint in the police station claiming that his shadow is missing. As the police begin working on the baffling case, he drops a hint on an accident that could have been a murder.",0,0.1449
Sakath,26-11-2021,Kannada,Ganesh,Nishvika Naidu,Judah Sandhy,"A man participates in a reality show singing competition while pretending to be visually impaired. However, he witnesses a murder and then wonders how to reveal the truth without exposing his lie.",9,0.2462
Amruth Apartments,26-11-2021,Kannada,,,,"After a year-long marriage, a couple approaches a lawyer to file for divorce but encounter a life altering shock on the same day. Together, they must work out what they need more - a divorce or getting out of a police investigation?",0,0.1704
Rewind,16-04-2021,Kannada,Sampath Maitreya,Chandana Raghavendra,Sabesh Solomon,"When a crime reporter's daughter goes missing and the police reach a dead end, he resorts to using lucid dreams to track her down with the help of his wife, a scientist.",0,0.1396
Lanke,13-08-2021,Kannada,,Ester Noronha,,"Ram, a convict, steps out of jail to fall in love with the do-gooder Paavani.",0,0.2218
Ramarjuna,29-01-2021,Kannada,Anissh,Nishvika Naidu,Anand Rajavikram,A smart insurance agent realises the value of life after losing his dear ones. How he transforms and seeks justice after the incident forms the rest of the story.,0,0.1198
Buy 1 Get 1 Free,12-11-2021,Kannada,Kishore,,,"Two twins con people and make a living in the city, an unknown call takes to them historical place and encounter with Manmatha changes their life forever.",0,0.0832
Indira,16-09-2021,Kannada,Shafi,Neethu Shetty,,"While Indira survives a suicide attempt, her husband Sridhar is not so lucky. With a loss of memory and eyesight, Indira is shocked when she observes a pattern revolving around her caretaker and psychiatrist. Watch the psychological thriller, Indira.",0,0.077
Dollu,20-11-2021,Kannada,,,,,0,0.0549
Huttu Habbada Shubhashayagalu,31-12-2021,Kannada,Diganth Manchale,,V. Sridhar,"At a birthday party, birthday boy Avinash was murdered by someone in the house. Who is the killer and what is the motive behind the crime?",0,0.0921
Seventeeners,20-11-2021,Kannada,,,,"Hari and Deepa enter a classroom on a Saturday evening after the classes are over. The two 17-years-olds appear to make a video as they indulge in intimacy off-screen. Monday morning, the two are summoned to the principal's office and are told that their video is now on the internet. Their parents are called and given the news of rustication, pending committee decision whether to expel or retain them. The two families are devastated by the news, as they try to pick up the pieces and move forward. At the committee meeting, chaired by the principal, they discuss the fate of Hari and Deepa. Owing to past incidents of misdemeanor, the committee, with the exception of physical trainer Abdul, vote to expel Deepa and retain Hari. But Abdul brings up the caste angle to it. While Hari is a Brahmin boy, Deepa is a Dalit and the issue takes a dramatic turn, leading to irreversible changes in the lives of the stake holders.",0,0.0835
Whispers and Echoes,28-09-2021,Kannada,,,,"Film reflects thoughts, emotions and memories of the narrator, which echoes all our flaws, depravities, everything that makes us humans and broken.",0,0.0357
Sushant,01-01-2021,Kannada,,,Paul Alex,Kannada movie,0,0.083
Kannadiga,17-12-2021,Kannada,,,,"Gunabhadra, a descendant of writer Samanthabhadra, wants to preserve the Kannada language and fulfil his ancestors' dream. He thinks he has found an ally in German Ferdinand Kittel. But, will he overcome the obstacles that come with it?",0,0
Pinni,04-06-2021,Kannada,,,,"Journey of Prajwal, aka Pinni from his childhood to his adulthood, and how he finds his passion against all social norms.",0,0
K.G.F: Chapter 2,14-04-2022,Kannada,Yash,Raveena Tandon,Ravi Basrur,"The blood-soaked land of Kolar Gold Fields (KGF) has a new overlord now - Rocky, whose name strikes fear in the heart of his foes. His allies look up to Rocky as their Savior, the government sees him as a threat to law and order; enemies are clamoring for revenge and conspiring for his downfall. Bloodier battles and darker days await as Rocky continues on his quest for unchallenged supremacy.",7.432,4.8153
Kantara,30-09-2022,Kannada,Rishab Shetty,Sapthami Gowda,B. Ajaneesh Loknath,"Shiva, a tribal vagabond lives with his mother in hamlet, stays away from the traditional Daivaradhane and Bhoota Kola legacy due to an unforgettable childhood incident. He is happy loafing around with his friends and doing petty jobs for his landlord. When Forest officer Murali enters the scene, it gives a fresh dimension to the man-vs-nature fight. Can Shiva save the forest from Murali? Or is Murali just a dummy bait cast by bigger fish?",7.19,4.0084
777 Charlie,10-06-2022,Kannada,Rakshit Shetty,Sangeetha Sringeri,Nobin Paul,Dharma is stuck in a rut with his negative and lonely lifestyle and spends each day in the comfort of his loneliness. A pup named Charlie who is naughty and energetic which is a complete contrast with the Dharma’s character enters his life and gives him a new perspective towards it.,7.6,2.7374
Gaalipata 2,12-08-2022,Kannada,Ganesh,Nishvika Naidu,Arjun Janya,"Life surprises you with its weird plans and events which changes our lives so much so that we can never go back to being what we were earlier. At such times we have to rise against the wind just like a kite does. It is the same with the story of Gaalipata 2. Its story is set in two different time zones, in two different places but with the same characters. It's about a turbulent yet fun filled journey of three friends and their love interests.",1,0.5044
Banaras,04-11-2022,Kannada,Devaraj,Sonal Monteiro,B. Ajaneesh Loknath,"An astronaut from an indefinite future fall in love with a girl in present time each other. When his i love is threatened by an existential element, responsibility falls on him to save her, using his future knowledge as an edge ahead.",4,0.8077
Vikrant Rona,28-07-2022,Kannada,Sudeep,Nirup Bhandari,B. Ajaneesh Loknath,"Almost half a century ago, a remote village in the middle of a tropical rain forest starts witnessing a series of unexplainable events which they attribute to the supernatural. Vikrant Rona, An eccentric police officer, is assigned to solve the mystery.  A mysterious game unfolds where everyone in the village is a potential victim and everyone is a suspect.",6,0.9996
Gandhada Gudi,28-10-2022,Kannada,Puneeth Rajkumar,,B. Ajaneesh Loknath,"A narrative by Puneeth Rajkumar aka Appu which explores state of Karnataka - the land, its culture and traditions, it's social issues and even it's forests, all through his curious eyes. The film is almost Appu's own journey of discovery as he understands the rich flora and fauna of the state.",7,0.6317
Bytwo Love,18-02-2022,Kannada,Dhanveer Gowda,Sreeleela,B. Ajaneesh Loknath,A young couple leave their hometown because of their uncomfortable relationship with their family and end up working for a matrimony agency. Will they be able to have a happy marriage?,6,0.3458
Raana,11-11-2022,Kannada,Shreyas Manju,Samyuktha Hegde,,Raana an aspiring Police Office enters Bengaluru City. He's all set to marry Priya. Kapaali is killed under mysterious circumstances. Raana is blamed. He sets out to find the real killer.,0,0.5165
Vedha,23-12-2022,Kannada,Shivaraj Kumar,Aditi Sagar,Arjun Janya,"Vedha and his daughter Kanaka are on a killing spree. They are being chased by a cop Rama, but they always manage to escape in the nick of time. Can Rama stop the killings?",4.9,0.5819
One Cut Two Cut,03-02-2022,Kannada,Danish Sait,Samyukta Hornad,,"Gopi, an arts and crafts professor, on his first day at work faces the task of saving the school which has been taken hostage by four radical social media activists.",4.5,0.5212
Hosa Dinachari,22-12-2022,Kannada,,,,"Three Families heal each other, while they spend their most difficult times with Strangers",0,0.5456
Family Pack,16-02-2022,Kannada,Likith Shetty,Amrutha Iyengar,Gurukiran,Upcoming Kannada comedy entertainer starring Likith Shetty and Amrutha Iyengar in the lead.,0,0.4526
Avatara Purusha: Part 1,06-05-2022,Kannada,Sharan,Ashika Ranganath,Arjun Janya,"When a son of an Ayurveda scholar goes missing, he blames his sister and cuts all ties with her. When the latter's daughter decides to set things right with a devious plan, there seems to be more trouble waiting for the family.",4.977,0.5786
Love Mocktail 2,11-02-2022,Kannada,Darling Krishna,Rachel David,Raghu Dixit,A sequel to Love Mocktail. Revolves around Aadi after the demise of his wife Nidhi. How does he move on from such a loss?,5.5,0.4492
Head Bush: Vol 1,21-10-2022,Kannada,Dhananjay,Sruthi Hariharan,Charan Raj,"Head Bush revolves around Jayaraj, his friends, foes, police officers, and the politicians who changed the course of the political scenario of Bengaluru in the 1970s. The film focuses on the rise and rise of Jayaraj - from a teenager to a rowdy to a mass hero.",5,0.4686
James,17-03-2022,Kannada,Puneeth Rajkumar,Priya Anand,Charan Raj,"Santhosh Kumar, who goes by the name James, runs a security agency and has been commissioned to take care of a family that owns a drug cartel. He is swift, agile and deft with his work and wins the appreciation of everyone. But is there more to who Santhosh really is?",5.9,0.5258
Shokiwala,29-04-2022,Kannada,Ajai Rao,Sanjana Anand,V. Sridhar,Shokiwala is a romantic action entertainer movie directed by Jocky B and produced by T R Chandrasekhar. The movie cast includes Krishna Ajai Rao and Sanjana Anand are in the lead roles while Shridhar V Sambhram scored music.,0,0.4242
Dharani Mandala Madhyadolage,02-12-2022,Kannada,Naveen Shankar,Aishani Shetty,,Upcoming Kannada Film starring Naveen Shankar & Aishani Shetty in the lead roles,0,0.3652
Chase,15-07-2022,Kannada,Pramod Shetty,Radhika Narayan,Karthik Acharya,"Visually-impaired former cop Nidhi finds herself being part of an unexpected accident scene. She goes to report it to the cops, where CCB officer Avinash takes charge of the case. This case brings unexpected closure for both the complainant and the investigating officer in different ways.",0,0.2681
Vijayanand,09-12-2022,Kannada,Prakash Belawadi,,,"Vijay, a 19-year-old boy, starts his transport business at a very young age from Gadag, a small city in the heart of North Karnataka. Although he faced many difficulties in the beginning, he bravely faced all of them and started his business with just one truck and till now he became the owner of 4300 vehicles. In this story, a father worries that his son may get into trouble by venturing into a new business that he doesn't know about. But the same son will one day grow up in the same industry and become a big businessman. Vijayanand Road Lines (VRL) has now grown into one of the largest transport companies in India. Vijay also ventures into media business.",0,0.2228
Petromax,15-07-2022,Kannada,Sathish Ninasam,Hariprriya,J Anoop Seelin,"Petromax is a brand name for a type of pressurised paraffin lamp that uses a mantle. Petromax symbolises light, which is essential in the lives of four orphans around whom the plot revolves",3.5,0.2797
Hope,08-07-2022,Kannada,,,,Hope is a film that tries to showcase the rampant corruption that's seeded through various layers of the system.,1,0.2926
Lucky Man,09-09-2022,Kannada,Darling Krishna,Sangeetha Sringeri,,"Arjun and Anu, best friends who are married, are on the verge getting a divorce. Arjun happens to meet God, who inquires about what went wrong with this couple. If Arjun gets a second chance to live his life without making the same mistakes, can he get a happily ever after?",6,0.3137
Love 360,19-08-2022,Kannada,Gopalkrishna Deshpande,Rachana Inder,Arjun Janya,"The plot of Love 360 revolves around the couple Ram and Janaki, who face countless obstacles in the path of their true love.",0,0.1534
Man of the Match,05-05-2022,Kannada,,,Nobin Paul,A Director calls for an audition and makes a movie out of it by creating conflicts between the artists who attend the audition. First of its kind realistic commercial film in Kannada that has multiple characters and touches upon current social conflicts in a humorous and satirical way.,5.5,0.1244
Dear Vikram,30-06-2022,Kannada,Sathish Ninasam,Shraddha Srinath,,"When Nitya, an academically bright student meets Vikram, who has strong views on politics and idealism, it seems like a match made in heaven. With time they realise that their views are diametrically opposite and that they want different",8,0.2223
Champion,14-10-2022,Kannada,Rangayana Raghu,Sunny Leone,B. Ajaneesh Loknath,,0,0.2923
Home Minister,01-04-2022,Kannada,Upendra,Vedhika,,"Home Minister is a Kannada movie, directed by Sujay K Srihari. The film is a family drama with a political backdrop, which stars Upendra and Vedhika in lead roles. Supporting roles include Sadhu Kokila and Avinash. It is produced by Poorna Naidu.",0,0.1845
Guru Shishyaru,23-09-2022,Kannada,Sharan,Nishvika Naidu,B. Ajaneesh Loknath,"Set in a village called Bettadapura, Gurushishyaru is a tale of Manohara who joins a school only for the sake of acquiring an experience certificate. But he is thrown into deeper conflicts when his connection gets stronger with students and the villagers. Will Manohara succeed in restoring freedom and respect in Bettadapura using his sports experience?",0,1.204
Dr. 56,09-12-2022,Kannada,Rupesh Kumar,Priyamani,Nobin Paul,Arjun is a theater artist who is suffering from an illness and has to take a pill every 56 minutes. Parallel to his misery is a murder investigation of three neurosurgeons lead by CBI officer Priya Krishna. Priya meets Dr Ashwath and the two go on an exposition about the medical mafia and its consequences.,5.7,0.2059
Critical Keertanegalu,15-07-2022,Kannada,Suchendra Prasad,Apoorva Bharadwaj,,"A Lawyer called Kariyappa, he has been instrumental in filing the flaws in society, During IPL season, Gambling became a reality and millions became victims of the year. Realising that he comes to court to file an appeal against IPL for the of ban the IPL. He describes the four gambling events happened in Karnataka. All this as lawyer Kariyappa puts it infront of judge.",10,0.2244
Raymo,25-11-2022,Kannada,Ishan,Ashika Ranganath,Arjun Janya,"Revanth deshpande a rich kid, but never dependent on his father's money. What ever he earned he earned from his music talent, yes he is Rockstar, his name as a Rockstar is RAYMO. Raymo lost his mother when he was 10 year old. He always missed mother's love. Because his father got married another woman right after his mother's death. There is no good relationship between father and son. Raymo is very unpredictable, psychic, drug addict, and a 100% womanizer. As he gets a recognition from the foreign company now he is in search of a female voice especially carnatic vocalist. He finds one she is Mohana, once Mohana enters Raymo's life. Everything starts changing as both protagonists are in love. But there are en number of hurdles for there love. Will there love be successful???",0,0.1759
Dil Pasand,11-11-2022,Kannada,Darling Krishna,Nishvika Naidu,Arjun Janya,A Cute and Romantic Love story presented keeping in mind today's generation,0,0.7609
