Title,Release Date,Language,Hero,Heroine,Music Director,Overview,Vote Average,Popularity
Yajamana,01-12-2000,Kannada,Vishnuvardhan,Prema,Rajesh Ramanathan,"Shankar sacrifices his own interests and refuses to marry in order to support and educate his younger brothers. However, his life changes when a girl falls in love with him.",0,0.4394
Shabdavedhi,02-01-2000,Kannada,Dr. Rajkumar,Jaya Prada,Hamsalekha,"Shabdavedi is about Sandeep Rajkumar, a strict police officer crusading against narcotics. The man is so straight that when his wife Jaya Prada refuses to reveal the identity of a key link in the drug ring that he is investigating. He beats her in lockup. Eventually he overcomes all the usual attempts to throw him off the chase like tarnishing his reputation and implicating him in lock-up death cases and tracks the ring down to its last man.",5.5,0.3494
Preethse,01-01-2000,Kannada,Upendra,Sonali Bendre,,"Preethse is a 2000 psychological thriller Kannada film starring Upendra, Shivrajkumar and Sonali Bendre.",0,0.2662
Sparsha,09-06-2000,Kannada,Sudeep,Sparsha Rekha,Hamsalekha,"Sudeep accidentally knocks down Radha on the railway tracks and she loses a leg. Guilt-ridden, he offers to marry her without letting her know that he was behind the accident.",5.7,0.2573
Durgada Huli,24-02-2000,Kannada,Sai Kumar,B. V. Radha,,An archaeologist races against time to find a buried treasure after someone kidnaps his family and holds them hostage to make a trade.,0,0.2176
Munnudi,27-10-2000,Kannada,H. G. Dattatreya,Tara,V. Manohar,"A film based around the life of a Muslim woman, Rukhia Begum, set in the coastal regions of Dakshina Kannada. She gets married to an Arab businessman who later deserts her. The story essays Rukhia Begum's struggles to protect her daughter.",0,0.1516
Preethsu Thappenilla,12-05-2000,Kannada,V. Ravichandran,Chitra Shenoy,V. Ravichandran,"A happy-go-lucky man falls head over heels in love with a girl at first sight. By a twist of fate, they become victims of a tragic incident, which takes their relationship to the next level.",0,0.0901
Husharagiri,01-01-2000,Kannada,,,Raja,An adult themed Kannada movie,0,0.0214
Usire,06-04-2001,Kannada,V. Ravichandran,Rachana Banerjee,Ilaiyaraaja,"The story revolves around Mutthu (Ravichandran) who works for the Zamindar Rudre Gowda (Prakash Raj). He falls in love with Gowda's daughter Chandri (Rachana). Chandri also feels the same way, however, their differing castes become a barrier and they hesitate to start a relationship. Will they get married towards the end is the crux of the story.",0,0.4958
Kotigobba,16-11-2001,Kannada,Vishnuvardhan,Priyanka Upendra,Deva,"A humble auto driver leads a happy and content life with his ambitious siblings. However, his siblings are unaware of their brother's past.",9,0.3947
neelambari,09-10-2001,Kannada,Devaraj,Ramya Krishnan,Paul Praveen Kumar,"Vinod, a reporter, and his crew arrive in Neela Betta to film a supernatural occurrence. However, things take a turn when after interviewing Akhila, a villager, the entire crew goes missing.",0,0.254
Huccha,06-07-2001,Kannada,Sudeep,Rekha Vedavyas,Rajesh Ramanathan,"Sachidananda, a popular student, wins the collegiate elections through influence and violence. Simultaneously, he makes some enemies and ends up falling in love with a conservative girl.",5.9,0.1541
Kotigalu Saar Kotigalu,27-12-2001,Kannada,Ramesh Aravind,Prema,,"Kotigalu Saar Kotigalu is a 2001 Kannada film directed by S. V Rajendra Singh Babu and produced by Jai Jagadish. The film stars Ramesh Aravind, S. Narayan, Mohan Shankar and Prema in lead roles. Music was composed by Hamsalekha.",0,0.2599
Diggajaru,26-01-2001,Kannada,Vishnuvardhan,Umashree,Hamsalekha,"A rich landlord and his servant bond well irrespective of their status. When the landlord wife is murdered, the servant decides to take the blame on himself to save landlord family prestige.",0,0.3841
Amma Nagamma,18-09-2001,Kannada,Charan Raj,Ragasudha,Gopikrishna,,0,0.1909
Kurigalu Saar Kurigalu,22-03-2001,Kannada,Ramesh Aravind,Prema,Hamsalekha,"Kurigalu Saar Kurigalu is a 2001 Kannada film directed by S. V Rajendra Singh Babu. The film stars Ramesh Aravind, S. Narayan, Mohan Shankar and Prema in lead roles. Music was composed by Hamsalekha.",0,0.2079
The Dusk,25-07-2001,Kannada,H. G. Dattatreya,Pavitra Lokesh,,The story revolves around the struggles faced by old people to cope with the changing times and values.,0,0.1153
Banallu Neene Buviyallu Neene,29-10-2001,Kannada,Shashikumar,Divyaa Unni,Prasanth Raj,"Gopala Krishna is forced into rehabilitating Lalitha, an amnesiac. He pretends to be her husband in order to help her recover but problems arise when her real husband shows up.",0,0.1773
Nanna Preethiya Hudugi,06-04-2001,Kannada,Sammir Dattani,,,"Nanna Preethiya Hudugi (transl. The Girl I Love) is a 2001 Indian Kannada-language romance film directed and written by Nagathihalli Chandrashekar. It stars newcomers Dhyan and Deepali in lead roles and actors such as Lokesh, Bhavya and Suresh Heblikar in other prominent roles.  The story is based on Chandrashekar's own decade-old short story ""Malenada Hudugi, Bayaluseeme Huduga"".",0,0.1017
Afternoon Song,31-12-2001,Kannada,,,,"In a world which runs on the steam of individualism, how satisfying can the inner journey be? Does a worldview that looks at a purpose beyond the self, hold currency in a society drained of cultural values and driven solely by market considerations? This is the dilemma that haunts the protagonist. Integral to this experience is the loss of intensity and social integrity that marked the cultural movement of the '70s, particularly after the Emergency. The film aims to capture this existential predicament in its various shades and tones. It is this struggle, perhaps vain, that forms the central theme. And, quite fatalistically, see no logical conclusion. Leaving the protagonist suspended in the grey area between ideals and reality...",0,0.0071
Hollywood,06-12-2002,Kannada,Upendra,Felicity Mason,Gurukiran,"Hollywood is a 2002 Indian Kannada science fiction film written by Upendra and directed by Dinesh Babu. It stars Upendra in a triple role as Surendra, Upendra and US 47 (a robot) along with the Australian actress Felicity Mason as Manisha and Anant Nag. The film was shot entirely in Gold Coast, Australia with few supporting actors and a monkey named Lakshmi, voiced by Ramesh Bhat. The film was also dubbed into Telugu in 2003, retaining the same title.",7.2,4.5074
Dhruva,13-09-2002,Kannada,Darshan Thoogudeepa Srinivas,Sherin Shringar,Gurukiran,An honest police officer who has taken an oath to clean up society must make some hard decisions when his friend becomes a criminal.,0,0.6713
Appu,26-04-2002,Kannada,Puneeth Rajkumar,Rakshita,Gurukiran,,0,0.3393
The Island,27-12-2002,Kannada,Avinash,Soundarya,,"Located in the backwaters of a dam, Sita Parvata is an island slowly submerging due to the rains. The government succeeds in evacuating the residents by giving them compensation for the properties they own. The village temple priest Duggajja, his son Ganapa, and his daughter-in-law Nagi find it impossible to leave their homeland and make a living with the meager compensation given by the government. On the island, they are important people, but outside, they would be one among hundreds of families struggling to make a living. The film narrates the struggles of the family and how ultimately in the end they manage to continue life on the island.",6.5,0.3593
Chandu,10-05-2002,Kannada,Sudeep,Sonia Agarwal,Gurukiran,A 2002 Kannada film,2,0.2237
Ekangi,01-01-2002,Kannada,V. Ravichandran,Ramya Krishnan,,"Ekangi is a psychological thriller which portrays the peace and joy in lonely life. Ravi, an adult who happily lives alone in a big house and always follows his father's last words ""Be happy to be alone, Be alone to be happy"". One day at a bar, he falls for a beautiful lady and invites her to his house. From that moment, how Ravi's life takes wrong turn forms the rest of the story.",0,0.2172
Nagarahavu,22-08-2002,Kannada,Upendra,Jyothika,Hamsalekha,"Ajay Sharma is set out to kill Madan Chopra and destroy his family, who is responsible for Ajay's father, Vishwanth's death. Will Ajay succeed?",0,0.1522
Super Star,01-01-2002,Kannada,Upendra,Keerthi Reddy,,A 2002 Kannada film.,0,0.1528
Naanu Naane,01-01-2002,Kannada,Upendra,,,A 2002 Kannada film.,0,0.1985
Guest,08-08-2002,Kannada,Prakash Raj,,,"Atithi is an attempt to examine the 'other face' - flashes of humanity - of a young man totally immersed in the cult of terrorism. Strange as it may sound, we also see flashes of violence (at times) that trickle into the thinking of another man with total belief in non-violence as the ultimate truth of life.",0,0.1834
H2O,29-03-2002,Kannada,Upendra,Priyanka Upendra,Sadhu Kokila,A 2002 Kannada film.,7,0.1276
Balagalittu Olage Baa,01-01-2002,Kannada,Mukhyamantri Chandru,Chitra Shenoy,,A 2002 Kannada movie.,0,0.1199
Dakota Express,11-04-2002,Kannada,Rockline Venkatesh,,Hamsalekha,"Owners of a bus, Krishna and Sundar, face numerous problems due to poor conditions. However, their life takes a turn when the daughter of the minister takes refuge in their bus.",0,0.1573
Simhadriya Simha,07-06-2002,Kannada,Vishnuvardhan,,,"Narasimhe Gowda (Vishnuvardhan), head of 48 villages has high regards for his sincerity and wisdom in his judgements. After his untimely death, his elder son Gowda (Vishnuvardhan) takes his throne and passes a wrong judgement against his brother Chikka (Vishnuvardhan). What circumstances lead to this",6,0.0831
Thavarige Baa Thangi,01-11-2002,Kannada,Shivaraj Kumar,Radhika Kumaraswamy,,,0,0.1356
Three Months of Solitude,31-12-2002,Kannada,,,,"When you’re in a crowd you prefer  to be alone. When you’re alone,  you want to be part of a crowd.  You’re never satisfied with yourself,  Wherever you are……  The protagonist of this film is an Indian  who is in Finland for three months on  a scholarship. His sense of alienation  Is not merely because of physical detachment  from life familiar to him but also due to a subjective  point of view. He feels he is trapped in  a dream…a reverie that doesn’t satisfy his soul.",0,0.0585
Chigurida Kanasu,02-10-2003,Kannada,Shivaraj Kumar,,V. Manohar,"Shankar, a city lad, pays a visit to his ancestral village. When he decides to settle there for good, he faces opposition from his own family and from a village bigwig.",0,0.4807
Kutumba,27-03-2003,Kannada,Upendra,M.N. Lakshmi Devi,Gurukiran,A 2003 Kannada film.,0,0.4365
Kiccha,11-04-2003,Kannada,Sudeep,Shweta Agarwal,Hamsalekha,"Kiccha, an unemployed gold medalist tries his best to get a job but due to corrupt bribe system, he fails to get any job. This story tells how an intelligent unemployed youth enters politics and turns big playing their own game against them.",0,0.2836
Abhi,25-04-2003,Kannada,Puneeth Rajkumar,Divya Spandana,Gurukiran,"Neighbors Abhi and Bhanu fall in love, but Bhanu's father comes to know about it and shifts to Hubli. Later, Bhanu runs away to Bangalore to tell a hidden truth to Abhi.",6,0.3018
Excuse Me,05-12-2003,Kannada,Ajai Rao,Divya Spandana,R. P. Patnaik,"Ajay makes a tune which Madhu loves, but she doesn't know who the composer is. Sunil, a selfish brat, pretends to be the composer of the tune in order to woo Madhu.",0,0.3204
Swaathi Mutthu,26-12-2003,Kannada,Sudeep,Meena,Rajesh Ramanathan,"Shivayya, who suffers from autism,  impulsively marries Lalitha, a young widow, against the customs of his village. They move to the city to escape from the wrath of the societal judgement.",6,0.2348
Vijaya Dashami,06-06-2003,Kannada,Sai Kumar,Soundarya,Deva,A wealthy kind hearted landlord who is very happy about the return of his son from the oversees. His happiness comes to an end when the hidden truth about his 6 year old daughter who is come down to meet her grand parents is revealed to them.,0,0.1884
Raktha Kanneeru,18-09-2003,Kannada,Upendra,Ramya Krishnan,,"A young Indian man becomes westernised and starts hating the Indian rituals and culture. He falls in love with a sex worker, but marries a girl from his village to fulfil his parents' wish.",8,0.2736
Gokarna,25-12-2003,Kannada,Upendra,Rakshita,Gurukiran,A 2003 Kannada film.,0,0.1524
Katthegalu Saar Katthegalu,27-03-2003,Kannada,Ramesh Aravind,Meghna Naidu,Hamsalekha,Katthegalu Saar Katthegalu is a 2003 Kannada film directed by S. V Rajendra Singh Babu and produced by . The film stars Ramesh Aravind and Ruthika in lead roles. Music was composed by Hamsalekha.,0,0.1357
Artha(Purpose),30-12-2003,Kannada,Rangayana Raghu,,,"As the soul of the film is communal harmony Artha has been shot in an ancient fort of Gulbarga where people belonging to different communities are living in the same place. The very reason for choosing this location is to portray the past glory and the present fact on the same plane. Though the story of the film is based on a family of North Karnataka, Suresh has not used their local language to make it more generic as this can be story of any region he says.",0,0.1519
Olu Saar Bari Olu,28-11-2003,Kannada,Ramesh Aravind,Anu Prabhakar,Rajdev,,0,0.1675
Kariya,03-01-2003,Kannada,Darshan Thoogudeepa Srinivas,Abhinaya Sri,Gurukiran,"Kariya, a gangster falls for a rich dancer Maya, but hesitant to express his love due to his criminal history. Meanwhile his enemies in the echelons of underworld conspire to have him murdered.",0,0.1702
Paris Pranaya,18-04-2003,Kannada,Raghu Mukherjee,Tara,Stephen Prayog,"While studying music in France, a young woman falls in love and learns her uncle's boss wants to marry her.",0,0.3475
Ondagona Baa,23-10-2003,Kannada,V. Ravichandran,,,A Kannada language remake of Telugu blockbuster film Kalisundam Raa (2000).,0,0.1086
Ree Swalpa Bartheera,03-09-2003,Kannada,Shashikumar,Kausalya,Venkat Narayan,,0,0.0839
Apthamitra,27-08-2004,Kannada,Vishnuvardhan,Soundarya,Gurukiran,"Apthamitra movie is based on Nagavalli (Dancer). Ramesh, an engineer buys the palace. Everyone believes that the spirit of Nagavalli, a dancer is captivated in a room of that palace. Ganga she opens  the locked room with the help of Soumya. Then start the troubles. Vijay  who came to ramesh house for holidays.",8.2,0.9974
Durgi,28-04-2004,Kannada,Ashish Vidhyarthi,Malashri,Hamsalekha,"Durgi was living happily with her family in a small village. But 2 businessmen entered the village to make a sugar mill. They used to be drunk always. One day, they raped her sister and she died in hospital. When Durgi and her family were in agony, they killed Durgi's father. After this, she promises to kill everyone.",0,0.4893
Jyeshta,17-12-2004,Kannada,Vishnuvardhan,Ashima Bhalla,S A Rajkumar,"Jyeshta is a 2004 Indian Kannada language drama film starring Vishnuvardhan, Ashima Bhalla and Devaraj in the lead roles. The film, a remake of Malayalam film Valliettan (2000), is directed and written by director Suresh Krissna and features soundtrack from S. A. Rajkumar. The original version was directed by Shaji Kailas and featured Mammootty and Shobhana in lead roles.",0,0.2822
Love,09-07-2004,Kannada,Mohanlal,Rakshita,Anu Malik,"Ganga, who mistakes Vikram to be a womaniser, understands his character when he saves her from a fire accident. They become lovers, but things change when a mysterious woman enters their lives.",7.5,0.3794
Sahukara,24-09-2004,Kannada,V. Ravichandran,Rambha,,Sahukara is a 2004 Indian Kannada-language film directed by Om Prakash Rao and produced by K. Manju. It stars V. Ravichandran and Rambha in lead roles.  It was a remake of Tamil film Muthu.,0,0.1481
Kadamba,16-01-2004,Kannada,Vishnuvardhan,Bhanupriya,,"Rajashekar overhears his police officer father's conversation with his abductor, Sharat Chandra, to kill him. This incident changes the course of his life and turns him into a criminal.",0,0.1705
Omkara,18-09-2004,Kannada,Upendra,Preeti Jhangiani,Gurukiran,A 2004 Kannada movie.,0,0.1722
Bisi Bisi,22-01-2004,Kannada,Ramesh Aravind,Anu Prabhakar,Milind Dharmasena,"Bisi Bisi is a 2004 Kannada film directed by Ramnath and produced by Ajay Chandani. The film stars Ramesh Aravind, Anu Prabhakar and Shankar Rao in lead roles. Music was composed by Milind Dharmasena.",0,0.1861
Maurya,22-10-2004,Kannada,Puneeth Rajkumar,Meera Jasmine,,"Manu, a professional kick-boxer can do anything to fulfill his mother’s wish. Through all the ups and downs, he struggles hard to become the Ultimate Champion.",0,0.1955
Monalisa,07-05-2004,Kannada,Sammir Dattani,Sadha,,"Dyan's relationship ends when his girlfriend, Monalisa, dies in an accident. In order to fulfil his parent's wishes, he marries Spandana, who turns out to be an exact lookalike of Monalisa.",2,0.1866
Veera Kannadiga,01-01-2004,Kannada,Puneeth Rajkumar,Anita Hassanandani Reddy,Chakri,A man protects a slum and strives to keep its inhabitants safe from the negative elements. He also aims to avenge his father's death against the criminals who killed him.,5,0.2679
Haseena,01-04-2004,Kannada,,Tara,,"Hasina marries driver Yakub against his mother's wishes. The couple have three daughters, one of whom is disabled. Pregnant with their fourth child, the couple break social codes and do a pregnancy scan to ascertain the baby's gender. When Yakub realizes it is yet another girl, he becomes at turns abusive and neglectful, eventually leaving Hasina to fend for herself.",9,0.1249
Monda,01-04-2004,Kannada,Sai Kumar,Pavitra Lokesh,,,0,0.1393
Kalasipalya,15-10-2004,Kannada,Darshan Thoogudeepa Srinivas,Chitra Shenoy,,"Kencha, who is unable to pass his matriculation exam even after repeated attempts, decides to start a business. While his family supports him, the thugs in his locality oppose him at every turn.",0,0.1988
Malla,27-02-2004,Kannada,V. Ravichandran,Priyanka Upendra,V. Ravichandran,"Shiva, a florist's son, grows up to become a gangster. After his father is murdered, he sets out to take revenge against the culprits.",0,0.0544
Jogi,19-08-2005,Kannada,Shivaraj Kumar,Arundathi Nag,Gurukiran,"After a crime lord is murdered by Madesha, Nivedhitha, a journalist, sets out to meet him. She ends up meeting an old woman and promises to help her find her son, who is none other than Madesha.",7,0.7216
Pandu Ranga Vittala,30-12-2005,Kannada,V. Ravichandran,Rambha,V. Ravichandran,"Vithala gets married to two women, who are both unaware of each other's existence. He strives hard to keep them happy but encounters various obstacles in his endeavour.",0,0.43
Namma Basava,09-09-2005,Kannada,Puneeth Rajkumar,Sudharani,Gurukiran,"Basava (Puneet Rajkumar) runs a gym centre and lives with his brother Avinash and Sudharani (wife of Avinash), who treat him as their own son. When his brother start seeking a girl as his bride, he opines that he should select his future bride. He selects Gowri, daughter of an auditor who is working with Pampathy. Pampathys younger brother is Home Minister and Pampathys son is a vagabond womanizer. To gain her approval, Basava makes every effort, but before he can get her green signal, her engagement is fixed with the vagabond son of Pampathy. Supported by Gowris peppy and naughty grandmother (Lakshmidevi), Basava rises against the autocratic behaviour of Pampathy, challenges him in public, and wins, thereby also winning the heart and hand of Gowri.",0,0.3714
Rama Shama Bhama,09-12-2005,Kannada,Ramesh Aravind,Urvashi,Gurukiran,"Rama, a married man, has an affair with Priya who pursues him despite knowing about his wife. When his friend Shama learns of the affair, the latter decides to reunite him with his wife.",9.5,0.3867
Aakash,29-04-2005,Kannada,Puneeth Rajkumar,Divya Spandana,R. P. Patnaik,"While working odd jobs, Aakash, a wedding photographer, meets Nandini, who falls in love with his optimistic and good-natured personality. The film stars Puneeth Rajkumar and Ramya in the lead roles, while Ashish Vidyarthi and Avinash play pivotal roles. The movie was declared as a Blockbuster hit at the box office. The film found a 200 days run at the cinema halls in Karnataka.",0,0.3156
Dr. B. R. Ambedkar,30-12-2005,Kannada,H. G. Dattatreya,Padma Vasanthi,Abhiman,"Based on the life of Indian social reformer, jurist, academic-politician, B. R. Ambedkar. The film covers the period from his birth right up to his death.",0,0.375
Vishnu Sena,22-12-2005,Kannada,Vishnuvardhan,Lakshmi Gopalaswamy,Deva,"Vishnu Sena movie is the based on Finding the corruption.Vishnuvardhan is the professor in College.He builds the force by youngsters to kidnap the corrupt people and kill them. Even police investigation is also over.Finally, He tells that he had his own way to cure the ills of the society.",0,0.2099
Nenapirali,02-12-2005,Kannada,Prem Kumar,Vinaya Prasad,,"Kishore helps his friend Ekanth to woo the girl he loves, Indu, whereas Indu's sister falls in love with Kishore. However, when Ekanth marries Indu, an unfortunate incident tears them apart.",0,0.2067
Amrithadhare,07-10-2005,Kannada,Amitabh Bachchan,Divya Spandana,Mano Murthy,"Puru (Dhyan) and Amritha (Ramya) are a couple deeply in love with each other. It is a case of opposite poles attracting. Puru is everything that Amritha is not! The boy is religious and tight-fisted in money matters. His only ambition in life: to construct a house. Amritha likes to splurge and is an atheist. In the course of time, Puru realizes his ambition, and names the dream house as Amrithadhare - a birthday gift to his beloved wife. Everything is hunky dory in their small world. But fate springs an unpleasant surprise on them. Amritha is diagnosed as having brain cancer, and the doctor tells Puru that her days are numbered! A shocked Puru decides to make her remaining days as happy as possible. He takes her on a Bharat darshan. In the process, Amritha realizes a long-standing wish of hers too: to meet her favourite actor Amitabh Bachchan in Mumbai, who makes an appearance in the climax.",0,0.1941
Auto Shankar,09-09-2005,Kannada,Upendra,Shilpa Shetty Kundra,Gurukiran,Auto Shankar is a 2005 Kannada film.,2,0.3377
Valmiki,29-07-2005,Kannada,Shivaraj Kumar,Hrishitaa Bhatt,Gurukiran,A 2005 Kannada drama film.,0,0.2088
Mahasadhvi Mallamma,14-01-2005,Kannada,Rajendra Prasad,Meena,,"Mallamma, a Shiva devotee, marries Dharanna. She is excited to start a new life with her husband, however her in-laws treat her horribly and she loses faith in Lord Shiva.",0,0.1531
Aham Premasmi,27-05-2005,Kannada,V. Ravichandran,Aarti Chabria,V. Ravichandran,"A poor slum boy, detests love and meets Arati in college. She wants to find out, whether his love for her is not mere infatuation, but he overcomes all obstacles and his love breeds forever",0,0.1824
Aadi,04-03-2005,Kannada,Srinagar Kitty,Divya Spandana,Gurukiran,"Aadi transforms from being an unemployed young man to a responsible and kind businessman after a chance encounter with Aishwarya and her father, Uday Chandra.",0,0.1594
Ranachandi,25-03-2005,Kannada,Shobaraj,Prema,Maruti,,0,0.132
Magic Ajji,17-06-2005,Kannada,Mandya Ramesh,Sudharani,,Queen Rajeshwari Devi dies on her 100th birthday. She comes back as a friendly ghost to help her disowned daughter-in-law and grandson claim their place in the palace.,0,0.1237
Gowramma,03-06-2005,Kannada,Upendra,,,A 2005 Kannada film.,0,0.0877
Cyanide,08-01-2006,Kannada,Avinash,Malavika Avinash,,"""Cyanide"" is about the incidents that occurred in the peripheries of Bangalore after the assassins of former Prime Minister Rajiv Gandhi stepped into the city. The story revolves around a helpless couple who fall into the clutches of the gang and are taken hostage.",5,0.7933
Aishwarya,15-09-2006,Kannada,Upendra,Deepika Padukone,Rajesh Ramanathan,"Abhishek's been betrayed in love, and doesn't like girls. Aishwarya walks into his life and love starts to blossom, which is forever.",5,0.629
Mungaru Male,15-12-2006,Kannada,Anant Nag,Pooja Gandhi,Mano Murthy,"Preetham loves Nandhini, whose marriage is already fixed. He feels bad and leaves the place. Nandini challenges him to win her heart. Preetham accepts the challenge.",7.3,0.426
Ajay,04-05-2006,Kannada,Puneeth Rajkumar,Anuradha Mehta,Mani Sharma,"Ajay hides Paddu in his house without the knowledge of his father, trying to send her to Australia as she has a passport and a VISA. There is triumph everywhere for Ajay, a settled profession, a beautiful wife and defeat of his opponent Prakash Raj and his team.",6,0.2754
Thandege Thakka Maga,31-03-2006,Kannada,Ambareesh,,,A 2006 Kannada film,7.5,0.2607
Thavarina Siri,19-05-2006,Kannada,Shivaraj Kumar,Daisy Bopanna,Hamsalekha,Thavarina siri tells the brother and sister love.Mutthanna (Shivarajkumar) brings up his three sisters after his parents,0,0.2038
Tananam Tananam,24-11-2006,Kannada,Shaam,Divya Spandana,K Kalyan,"Tananam Tananam (Kannada: ತನನಂ ತನನಂ) is a 2006 Indian Kannada romantic musical drama film directed and written by Kavitha Lankesh. The film introduces Shaam, a Tamil actor, to Kannada cinema along with Ramya and Rakshita teaming up together for the first time, in the lead roles. The film was produced by N. M. Suresh and based on a Tamil short story written by Kalki. The film released on 24 November 2006. The film won two Filmfare Awards in Best Actress and Best Lyricist categories. Noted violinist L. Subramaniam was roped in to play violin bits in the film.",0,0.2536
My Autograph,17-02-2006,Kannada,Sudeep,Meena,Bharathwaj,"The story revolves around Shankar, working in an advertising agency who comes to his village to invite his friends to his marriage. He remembers the good old days and also sees how his friends are faring now. All this is told in flashback.",6.5,0.2459
